2020-08-05 06:49:50, Pregnancy during pandemic https t co fjH6HwLvYG https t co azhPlRfTuV , business bhutan , ,10629,Thimphu 
2020-08-05 06:43:45, With BSc Forestry students from the Royal University of Bhutan Fieldwork for Applied Conservation Science in southern Bhutan https t co 6Rd11w7z2n , JambayJax , ,25,Punakha 
2020-08-05 05:55:53, Bhutan in 30 seconds was recently featured on CNN TV Bhutan is a safe and still the number 1 destination to travel Here is the link to the original video https t co Z4wkpiKFBu bhutantourism bhutan happiness source Tourism Council of Bhutan , TsheringJatsho , bhutantourism bhutan happiness ,15,Thimphu 
2020-08-05 05:53:42, The explosion in Beirut is a mystery massive that killed atleast 100 amp 4k injured Damages reported upto 15miles from the explosion center We express heartfelt and sincere condolences to the departed souls in Beirut Sending so much love from Bhutan PrayforBeirutLebanon https t co pKibiyTDXC , ChadoLingpa , Bhutan PrayforBeirutLebanon ,12,Thimphu 
2020-08-05 05:53:20, On the joyous occasion of Birth Anniversary of Her Royal Highness Ashi Sonam Dechan Wangchuck the family of BhutanLaw lit thousand butter lamp amp offered our prayers for Her long happy life Her Highness is the champions of justice and rule of law With respect amp gratitude xf0 x9f x99 x8f https t co 1SX1SuTXzq , ChhedupSangay , ,1104,Thimphu 
2020-08-05 05:33:04, Yiga Chocolate and Mountain Hazelnuts kick off landmark collaboration to produce hazelnut chocolate https t co piyXanj4Kp https t co OBfxEPt6sG , business bhutan , ,10629,Thimphu 
2020-08-05 05:22:19, TenzingLamsang Jai Shree Ram and Many congratulations to BJP for filling your mandate Proud of you and keep making India great Best wishe , nidhi bhattarai , ,6,Thimphu 
2020-08-05 05:21:11, priyankac19 Jai Shree Ram and May congratulations to BJP for filling your mandate Proud of you and keep making India great Best wishes , nidhi bhattarai , ,6,Thimphu 
2020-08-05 05:16:50, The Ram Temple coming up is not only due to a Ram Temple movement of the early 90 xe2 x80 x99s but is also linked to the metooindia movement where a SC female employee made sexual harassment allegations against the former SC CJ An allegation for the executive to investigate or follow up , TenzingLamsang , metooindia ,23863,Thimphu 
2020-08-05 03:55:03, Meet your shaper Yeshi who is passionate about law and teaching xf0 x9f x92 xbc xf0 x9f x91 xa9 xe2 x80 x8d xf0 x9f x8f xab Keep following our posts to know your Thimphu shapers knowyourshapers shaers shapersbhutan https t co 8WUozZDtr9 , ShapersThimphu , knowyourshapers shaers shapersbhutan ,16,Thimphu 
2020-08-05 03:51:58, The number is 105 today with additional 2 returnees from MiddleEast testing positive for COVID19 test in Paro Bhutan Still NIL community transmission but the risks are increasing as more Bhutanese flaunt travel rules CoronaTimes CoronaVirusUpdates coronavirus , kuenzakarma , MiddleEast COVID19 Paro Bhutan CoronaTimes CoronaVirusUpdates coronavirus ,1380,Thimphu 
2020-08-05 03:42:01, For any country worried about multiple external enemies it is prudent to not start a new front within by antagonizing amp alienating its minority population Enemies at the gates will come amp go but problems created within will drain away the strength amp peace of a country amp society , TenzingLamsang , ,23863,Thimphu 
2020-08-05 03:02:44, Discovered this beautiful shop called Colours of Bhutan which had the most soothing colour palettes for summer hovering like soft whispers in our xe2 x80 xa6 https t co tRJvcDfDFn , LovenRamos , ,2123,Bhutan 
2020-08-05 02:50:25, Scary scene BBC News Beirut blast Lebanon in mourning after massive explosion https t co g6VykBy9SV , KinzangDendup1 , ,218,Thimphu 
2020-08-05 02:41:13, Jammu amp Kashmir New Vision New Horizon Combatting COVID 19 with robust testing hospital facilities and financial assistance to help the weakest sections of society OneYearofDevelopment PMOIndia DrSJaishankar MEAIndia IndianDiplomacy https t co azSMPKzJyh , Indiainbhutan , OneYearofDevelopment ,10581,Thimphu 
2020-08-05 02:38:23, Jammu amp Kashmir New Vision New Horizon Upgradation of the health infrastructure in J amp K to the tune of Rs 881 crores and an additional Rs 7500 crores of new projects including 2 AIIMS OneYearofDevelopment PMOIndia DrSJaishankar MEAIndia IndianDiplomacy https t co znTspiG87z , Indiainbhutan , OneYearofDevelopment ,10581,Thimphu 
2020-08-05 02:34:52, Jammu amp Kashmir New Vision New Horizon Jobs for youth of J amp K largest ever recruitment drive underway OneYearofDevelopment PMOIndia DrSJaishankar MEAIndia IndianDiplomacy https t co nt0ZjUgR3V , Indiainbhutan , OneYearofDevelopment ,10581,Thimphu 
2020-08-05 02:33:23, I would like to express and offer my heartfelt wishes and prayers for long life and happiness to HRH Ashi Sonam Dechan Wangchuck on HRH s joyous birth anniversary https t co X7ISPlNCwj , FMBhutan , ,3543,Thimphu 
2020-08-05 02:32:01, Jammu amp Kashmir New Vision New Horizon One Nation One Constitution OneYearofDevelopment PMOIndia MEAIndia DrSJaishankar IndianDiplomacy https t co BjZd4RdB6y , Indiainbhutan , OneYearofDevelopment ,10581,Thimphu 
2020-08-05 02:12:58, She had a marvelous time ruining everything , sandeeps13 , ,272,Thimphu 
2020-08-05 01:38:14, Tobacco Quota Outlets Written by Damcho Dorji former Minister for Foreign Affairs https t co BS3FUA5paJ , gasebtandin , ,2509,Thimphu 
2020-08-05 00:54:25, On the joyous occasion of the birth anniversary of Her Royal Highness Princess Sonam Dechan Wangchuck we the management and staffs of the Tourism Council of Bhutan would like to humbly join the nation in offering xe2 x80 xa6 https t co mS5AQoDGcl , tourismbhutan , ,12146,Thimphu 
2020-08-04 23:56:17, Beirut we are with you https t co E9xZjso6M4 , ChhedupSangay , ,1104,Thimphu 
2020-08-04 18:32:57, Long Live Her Royal Highness Princess Ashi Sonam Dechen Wangchuck xf0 x9f x99 x8f xf0 x9f x99 x8f xf0 x9f x99 x8f Palden Drukpa Gyalo BMT Happiness House https t co 7Ye58kSsKQ , bhutan majestic , ,1132,Thimphu 
2020-08-04 17:47:44, WangChimi Wow Impressive , NamgaySkidas , ,266,Paro 
2020-08-04 17:25:52, To the Princess of the Great Fourth Mother to HE Vairochana Rinpoche Inspiration for all Bhutanese I bow to thee prostate amp take refuge On Your 39th Birth Anniversary I amp my family would like to wish all the love peace and happiness Thank You for Your love and kindness la https t co wWKldlFTfA , ChhedupSangay , ,1104,Thimphu 
2020-08-04 16:41:58, deeprajchhetri Come to thimphu for haircut , Kash33513885 , ,10,Thimphu 
2020-08-04 16:41:15, deeprajchhetri Wow you must be looking handsome xf0 x9f x91 x8c , Kash33513885 , ,10,Thimphu 
2020-08-04 16:38:13, Arduino reading the sensor and using Particle Photon to push the data to GoogleDocs Sheet MiniProject Electronics Engineering https t co 6dLqeB8CXi , pradhan557 , Arduino sensor Particle Photon GoogleDocs Sheet MiniProject Electronics Engineering ,259,Thimphu 
2020-08-04 15:56:26, Fascinating stunning and mesmerizing place https t co g3blxKZNxr , KinzangDendup1 , ,218,Thimphu 
2020-08-04 15:54:12, DelmaKarma Beautiful , KinzangDendup1 , ,218,Thimphu 
2020-08-04 15:18:08, okay I vl follow her Ms https t co rY8oz2jj6a , SyedSaa1 , ,1550,Thimphu 
2020-08-04 15:05:22, why Ms Julia give me the reason https t co PLGYubQahz , SyedSaa1 , ,1550,Thimphu 
2020-08-04 15:01:26, BJP4India Excellent move by BJP Government People under poverty and Dalits are now taken care Kusur to BJP government Keep making India great Best wishes , nidhi bhattarai , ,6,Thimphu 
2020-08-04 14:47:00, Fourth COVID19 death in Jaigoan https t co wsQWzLvlPY , ChhedupSangay , COVID19 ,1104,Thimphu 
2020-08-04 14:35:04, GakiTenzin I need to do that as well Also it would be my final visit to that shop xf0 x9f x98 x82 , ChhedupSangay , ,1104,Thimphu 
2020-08-04 13:49:31, bhutanpdp Drowawangcha Pdp has a point Ruling govt should amend the law under special circumstances such as today I also support govt unilateral decision to open tobacco depot to protect citizens from COVID19 from tobacco smugglers , DziJ , ,1699,Thimphu 
2020-08-04 13:46:39, What I irritate most is the way our shopkeeper talk to their customers It s truly shocking at times Wonder if they can survive or how they sustain with this attitude God save them , ChhedupSangay , ,1104,Thimphu 
2020-08-04 13:38:16, xe2 x80 x9cDoing easily what others find difficult is Talent Doing what is impossible for Talent is GENIUS xe2 x80 x9d Henri Frederic Amiel BMT Happiness House https t co a0AGHgEPUd , bhutan majestic , ,1132,Thimphu 
2020-08-04 13:19:53, Guys new tiktok challenge MashayTeyChallenge cause its been a while Challenge 5 friends who you think would do this well using the above hashtag Spread the love xf0 x9f x98 x8a https t co VUVyYiM0Sa , mstudiobhutan , MashayTeyChallenge ,241,Thimphu 
2020-08-04 13:08:10, PDP on the legality of selling tobacco products by the government xe2 x80 x99s outlet https t co L3WUOESvZC , BBSBhutan , ,51583,Thimphu 
2020-08-04 13:07:45, Low price forces almost half of the Cordyceps collectors to withdraw from auction Saephu Gewog https t co ziSSp5kSiw , BBSBhutan , ,51583,Thimphu 
2020-08-04 11:31:54, adhik Joshi It definitely is , TenzingLamsang , ,23863,Thimphu 
2020-08-04 11:27:31, As Oscar Wilde once said xe2 x80 x98Imitation is the sincerest form of flattery xe2 x80 x99 India xe2 x80 x99s main opposition party unwittingly paid high praise to BJP by trying to do a Hindutva light on the Ram Temple Yet to see BJP voters taking this seriously but it will cost Congress among Muslims https t co X2HwjjJtnn , TenzingLamsang , ,23863,Thimphu 
2020-08-04 11:03:06, BBS Radio Article 19 Interim Government Section 1 to 6 https t co metvFXD8s9 , BBSBhutan , ,51583,Thimphu 
2020-08-04 10:59:31, Ministry of Health in collaboration with the World Health Organization Bhutan organized a field trip for the mainstream media houses last week The objective of this field trip was to orient the journalists on xe2 x80 xa6 https t co 2SXHxGzAty , MoHBhutan , ,1443,Thimphu 
2020-08-04 10:26:12, Magmi dasho is not my dasho , Tobgay333 , ,39,Thimphu 
2020-08-04 10:09:39, Tecio13 NiiNiiFC he don t deserve to be referee Hope FIFAcom FIFA will look into it , TsheringJatsho , ,15,Thimphu 
2020-08-04 10:03:34, Can t let go of something i want to xf0 x9f x98 x85 , BidhaChencho , ,103,Paro 
2020-08-04 09:42:11, DebaratiDas44 You re good at everything , davidmhecht , ,498,Thimphu 
2020-08-04 08:18:42, deeprajchhetri Thank you for the feedback la The website is not official amp still in development phase thus we haven t shared the website anywhere la For now kindly check this link on our website for information on eTeeru https t co CQHu37dV2z , TashiCell , ,1765,Thimphu 
2020-08-04 07:53:14, SangayKarp gasebtandin Yep that xe2 x80 x99s the only logical thing , DziJ , ,1699,Thimphu 
2020-08-04 07:44:47, JigsNews Who wears 2 condoms , zzezenn , ,1948,Thimphu 
2020-08-04 07:32:06, SaldanhaWinston Yes On all platforms , namgayzam , ,23302,Thimphu 
2020-08-04 07:10:31, My best wishes to H E Shri AmitShah Union Minister of Home Affairs of India for a speedy and complete recovery , FMBhutan , ,3543,Thimphu 
2020-08-04 07:01:07, Financial worries could keep you from pursuing an enjoyable ex More for Sagittarius https t co FfKav1h4Nc , kintsho bht , ,30,Thimphu 
2020-08-04 07:00:59, Keep secrets to yourself today betraying the confidence of so More for Taurus https t co EECfQYA8HL , cixx67 , ,1508,Thimphu 
2020-08-04 07:00:15, It s no use trying to force someone to like you so stop looki More for Pisces https t co uojyhA9mo8 , LobzangYeshey1 , ,314,Thimphu 
2020-08-04 06:47:13, First purchase from https t co mCNNph79ER Delivered within 45 min and with awesome packing and a wonderful thankful note They are changing the experience of online shopping in Bhutan all together xe2 x98 xba xef xb8 x8f definitely marking life xe2 x80 xa6 https t co qvNNgKMfwq , ManoJonaM , ,180,Thimphu 
2020-08-04 06:41:01, A large portion of the Dzongkhag falls under the Royal Manas National Park a preserve with an incredible biodiversity The iconic site of Sarpang Dzongkhag is the Phibsoo Wildlife Sanctuary TourismBhutan xe2 x80 xa6 https t co yOOGYmVuLc , tourismbhutan , TourismBhutan ,12146,Thimphu 
2020-08-04 05:54:32, xe2 x80 x9cWe need to look at the development of a society or a business not purely from a perspective of financial transactions but from a holistic perspective xe2 x80 x9d xe2 x81 xa6 HaVinhTho xe2 x81 xa9 GNH https t co YPo5DKetIP , NaglerUNDP , GNH ,1592,Thimphu 
2020-08-04 05:50:55, Touching global heights in the practice of yoga Kuensel of date celebrates the achievements of Phuntsho Dema and Chainga Dorji winning the 2nd prizes in the MyLifeMyYoga competition organised by the MAYUSH and ICCR Yoga PMOIndia MEAIndia IndianDiplomacy ICCR Delhi https t co SxjvSSIikC , Indiainbhutan , MyLifeMyYoga Yoga ,10581,Thimphu 
2020-08-04 05:33:09, VuxxVuxx One piece , uchiha soma , ,66,Thimphu 
2020-08-04 04:14:11, arirang ASC too offcl Hello Too xf0 x9f x98 x8d Lots of love , DawaDDema1 , ,66,Thimphu 
2020-08-04 04:05:11, happy new week dear beautiful https t co hWZyt2WkpI https t co lb9EwPWkPH , SyedSaa1 , ,1550,Thimphu 
2020-08-04 03:59:43, My life https t co awjbgxC8ge , Jamyang83684768 , ,0,Thimphu 
2020-08-04 03:54:51, rstabhutan 1 seen driving course conducted during rush hour both within the city and on highway Risky for all 2 3 to 4 learners in one car cheaper but risky for all incase of mishap la , Tobgay3 , ,108,Thimphu 
2020-08-04 03:44:09, xf0 x9d x90 x82 xf0 x9d x90 xa8 xf0 x9d x90 xa7 xf0 x9d x90 xa0 xf0 x9d x90 xab xf0 x9d x90 x9a xf0 x9d x90 xad xf0 x9d x90 xae xf0 x9d x90 xa5 xf0 x9d x90 x9a xf0 x9d x90 xad xf0 x9d x90 xa2 xf0 x9d x90 xa8 xf0 x9d x90 xa7 xf0 x9d x90 xac Keep using eTeeru for more offers To claim your prize you can call 77889977 and dial extension 8978 during office hours eteeru tashicell luckydraw https t co Sr49z3CgAH , TashiCell , eteeru tashicell luckydraw ,1765,Thimphu 
2020-08-04 03:31:08, gasebtandin Absol necessary to follow due process to amend TCAB2010 but for greater good amp during unprecedented times COVID19 calls 4 unprecedented interventions The TCAB2010 says xe2 x80 x98no person xe2 x80 x99 does an agency become xe2 x80 x98a person xe2 x80 x99 confusing amp just a thought DrukNyamrup DrukDpt bhutanpdp , dawapenjor , ,1289,Thimphu 
2020-08-04 03:27:41, gasebtandin Ain xe2 x80 x99t Bhutan a recipient of a global award for being Tobacco free country What happens to the award Are we going to return it , DziJ , ,1699,Thimphu 
2020-08-04 03:00:28, Meet our shaper Phuntso Norbu an aspiring computer scientist knowyourshapers shapers shapersthimphu https t co PF0AfFhrL3 , ShapersThimphu , knowyourshapers shapers shapersthimphu ,16,Thimphu 
2020-08-04 01:54:29, pchilimzam Salute our own Karma Drupchu Director Bhutan s National Centre for Hydrology amp Meteorology NCHM for this very powerful imagery of Glacial Lake Outburst Flood GLOF as a Tsunami in the Sky , pnamgyel , ,631,Thimphu 
2020-08-04 01:40:31, PDP issued a press release on the Govt xe2 x80 x99s decision to transgress the clauses in The Tobacco Control Act of the Kingdom of Bhutan Section 11 b of the Act explicitly prohibits to manufacture sell or distribute the tobacco or tobacco products in the country https t co DGvjG4QlQQ , gasebtandin , ,2509,Thimphu 
2020-08-04 01:29:33, Domendrel bhutandayhike bhutantravel travelwithswallowtail bhutanswallowtail bhutanswallowtailtours Domendrel https t co E9pAy8BCHT , Swallowtail2014 , Domendrel bhutandayhike bhutantravel travelwithswallowtail bhutanswallowtail bhutanswallowtailtours ,386,Thimphu 
2020-08-03 17:09:23, Some glimpses of https t co rzzxzoTvRS new website wellnesswebsite wellnessapp apurvatamhane https t co ZP5pSMDmt1 , backyardheaven , wellnesswebsite wellnessapp apurvatamhane ,252,Thimphu 
2020-08-03 17:06:21, Some glimpses of https t co MerDMLLSOl website https t co JJ10RmTDHa , backyardheaven , ,252,Thimphu 
2020-08-03 16:50:59, Jaigaon lockdown from tomorrow https t co 7YMCykvx67 , ChhedupSangay , ,1104,Thimphu 
2020-08-03 14:41:58, 2 2 Many would have taken it home on the soles of their feet amp many more into shops amp restaurants nearby The irony is that this is a regular occurrence Just thinking of the health implications makes my head spin amp what if some of the waste is from a COVID 19 positive patient , TenzingLamsang , ,23863,Thimphu 
2020-08-03 14:41:06, 1 2 A short sharp burst of rainfall left many roads flooded including Norzin Lam where the sewage line burst open pouring out human sewage on the road The smell of feces amp urine pervaded the air as cars took the solution on their wheels all along our capital xe2 x80 x99s main street https t co 709h4EJcVw , TenzingLamsang , ,23863,Thimphu 
2020-08-03 14:22:52, https t co x6gbP4LkqS Things to See Do and Eat in Haa Valley Bhutan Brought to you by davidsbeenhere , MyBhutan , ,945,Thimphu 
2020-08-03 14:18:28, rkhuria2 He is not your English teacher If your concerned send your kids to English tuition If you get the zest of his talk you are done Best of luck , nidhi bhattarai , ,6,Thimphu 
2020-08-03 13:56:04, Scout leaders attend COVID 19 programme in Gelegphu https t co cvqItLGHtk , BBSBhutan , ,51583,Thimphu 
2020-08-03 13:55:36, New insignia system for forestry officials https t co mKgqacx4nI , BBSBhutan , ,51583,Thimphu 
2020-08-03 13:54:32, Jaigaon lockdown from tomorrow https t co l0oLASZE5N , BBSBhutan , ,51583,Thimphu 
2020-08-03 13:54:05, Healthy Drukyul online campaign a welcome move https t co iGDSLGJhfR , BBSBhutan , ,51583,Thimphu 
2020-08-03 11:16:17, The Signing of Record of xc2 xa0Discussion https t co mZUiRrGi0n , umsb123 , ,53,Thimphu 
2020-08-03 11:07:57, beautiful teeth Lisi https t co qqZv4Vcb0s https t co xxXwCtMUFA , SyedSaa1 , ,1550,Thimphu 
2020-08-03 10:54:07, Happy Monday dear Karen https t co n5pkYOoQ9K https t co vkZ98k43lT , SyedSaa1 , ,1550,Thimphu 
2020-08-03 10:40:12, Sexy Sarees are here dear https t co RNFQnF734R https t co lTolZscA4Y , SyedSaa1 , ,1550,Thimphu 
2020-08-03 10:11:36, The rain https t co cIClMHzZhQ , ChhedupSangay , ,1104,Thimphu 
2020-08-03 09:55:08, Destination xe2 x80 x93 Domendrel Location xe2 x80 x93 North Thimphu Total Distance xe2 x80 x93 One way up xe2 x80 x93 10 58 Km Elevation xe2 x80 x93 4103 m Elevation Gain xe2 x80 x93 1627m Time Taken xe2 x80 x93 7 hours 16 Minutes Moving Time xe2 x80 x93 4 hours 9 minutes Domendrel https t co YchBY4xCtL , Swallowtail2014 , ,386,Thimphu 
2020-08-03 09:17:17, A step towards greater FinancialInclusion mBoB available in Dzongkha https t co 5axb98oeiT , BankofBhutan , FinancialInclusion Dzongkha ,1284,Thimphu 
2020-08-03 09:16:24, VOTE for your favourite Dance Group through mBoB https t co M7cRUzHvvp , BankofBhutan , favourite mBoB ,1284,Thimphu 
2020-08-03 09:14:19, Coinciding with the World Rangers Day 2020 the Watershed Management Division REDD Secretariat launched the National REDD Strategy amp Action Plan of Bhutan https t co yiyGhWHYsB https t co Pg28lVHuqo , moafbhutan , ,461,Thimphu 
2020-08-03 07:22:31, Our next generation of women s cricketers xf0 x9f x8f x8f xf0 x9f x8f x8f xf0 x9f x8f x8f womenempowerment girlspower cricket bhutancricket sportsforall womensports https t co VCER5f7k4u , ugyen , womenempowerment girlspower cricket bhutancricket sportsforall womensports ,144,Thimphu 
2020-08-03 07:13:04, Thimphu City view from Sangaygang https t co HPRKE1ogzP Bhutan Thimphu PANdemic2020 sangaygang attractions worldtourplan traveltips traveltomorrow NewNormal2020 https t co nLVikDPrmk , worldtourplan09 , Bhutan Thimphu PANdemic2020 sangaygang attractions worldtourplan traveltips traveltomorrow NewNormal2020 ,193,Thimphu 
2020-08-03 07:03:44, VuxxVuxx Your not a human if you don t watch one piece xf0 x9f x98 x89 , uchiha soma , ,66,Thimphu 
2020-08-03 07:01:10, You yearn to share your feelings but getting together with pe More for Sagittarius https t co FfKav1h4Nc , kintsho bht , ,30,Thimphu 
2020-08-03 07:01:02, Improving your professional prospects will be empowering The More for Taurus https t co EECfQYA8HL , cixx67 , ,1508,Thimphu 
2020-08-03 07:00:16, Don xe2 x80 x99t be afraid to confront painful feelings this is you ll r More for Pisces https t co uojyhA9mo8 , LobzangYeshey1 , ,314,Thimphu 
2020-08-03 06:26:59, Located in Southern Bhutan Samtse Dzongkhag covers an area of 1 582 sq km and ranges from 600 3 800 m in altitude Samtse is a religiously diverse district and both Hinduism and Buddhism are widely practiced in xe2 x80 xa6 https t co sOBANYHiSy , tourismbhutan , ,12146,Thimphu 
2020-08-03 06:24:22, COVID 19 update from Bhutan xf0 x9f x87 xa7 xf0 x9f x87 xb9 Monday xe2 x80 x99s are always Busy so include wearing MASK SOCIALDISTANCE amp using DRUKTRACE making it full package Stay Safe xf0 x9f x99 x8f BMT Happiness House https t co okVDYUf4mq , bhutan majestic , COVID MASK SOCIALDISTANCE DRUKTRACE ,1132,Thimphu 
2020-08-03 05:57:51, Tremendous response from international amp domestic cos to GoI MeitY s production linked scheme to boost mfg MakeInIndia 22 mobile cos apply for India xe2 x80 x99s new incentive scheme GOI The New Indian Express https t co Leu6mRQaTu MEAIndia IndianDiplomacy DrSJaishankar , Indiainbhutan , MakeInIndia ,10581,Thimphu 
2020-08-03 05:56:20, HANDPICKED EXPERIENCES IN BHUTAN xe2 x80 x93 Druk Experience https t co zYeeqE77AR , DrukExperience , ,117,Thimphu 
2020-08-03 05:50:35, India xe2 x80 x99s mantra to combat COVID19 Test test and test From 100 tests a day to 600 000 samples a day 85 of which are RT PCR tests India ramps up covid diagnostics facilities tests over 20 mn samples https t co 03o7pCnbUU PMOIndia DrSJaishankar MEAIndia IndianDiplomacy , Indiainbhutan , COVID19 ,10581,Thimphu 
2020-08-03 05:08:54, Notification to collect academic transcript and provisional xc2 xa0certificate https t co B5sPdpnIaS , umsb123 , ,53,Thimphu 
2020-08-03 04:58:17, eldritchichor Pengluin ODETTE MA xe2 x80 x99AM MAY I HOLD YOUR HAND xf0 x9f xa5 xba xf0 x9f x92 x96 I love how you colour her hair oughh her entire design slaps , Caniiibal , ,142,Thimpu 
2020-08-03 04:46:29, BBS Radio Article 18 The Opposition Party Section 1 to 6 https t co chKK91iLeI , BBSBhutan , ,51583,Thimpu 
2020-08-03 04:37:21, The Hon ble Agriculture Secretary graced the World Rangers Day celebration at the Jigme Khesar Strict Nature Reserve Haa on 31 August and awarded new gosa or insignia to the forestry officials https t co SKsjz8x24k https t co XgTzxPz0q3 , moafbhutan , Haa ,461,Thimphu 
2020-08-03 04:36:14, And the 103rd COVID19 positive case in Bhutan is a 22 year old woman who recently returned from MiddleEast currently quarantined at Paro With 89 recovered and only 14 active cases we seem to be doing pretty well But then we do need public cooperation in keeping it at bay , kuenzakarma , COVID19 Bhutan MiddleEast Paro ,1380,Thimphu 
2020-08-03 04:10:12, You can xe2 x80 x99t just say xe2 x80 x98improve the UX xe2 x80 x99 any more than a business can say xe2 x80 x98make more money xe2 x80 x99 xe2 x80 x9d Chris Bank , cringngedup3 , ,55,Thimphu 
2020-08-03 03:25:02, Meet our shaper Chimi Wangmo Fell free to suggest her next read knowyourshapers shapers shapersthimphu https t co 10RTAteDdX , ShapersThimphu , knowyourshapers shapers shapersthimphu ,16,Thimphu 
2020-08-03 03:18:57, Domendrel at an elevation of 4103 m Total distance from motorable road 10 58 Km Maximum elevation gain just in 4 hours 1627 m A challenging hike travel bhutantravel bhutanswallowtailtours bhutantourism xe2 x80 xa6 https t co upCHwCxHy3 , Swallowtail2014 , travel bhutantravel bhutanswallowtailtours bhutantourism ,386,Thimphu 
2020-08-03 03:16:59, MrsTLBerger Baligubadle1 realDonaldTrump Bhutan don t want him We love America just not him , kuenzakarma , ,1380,Thimphu 
2020-08-03 03:16:05, UNDP Bhutan CRRinzin AzusaKubota NaglerUNDP ugdorji nawaraj77 The world forests are seen as crucial in fight against climate change But their health is under severe stress amp trees in millions are dying as a result of a warming climate This UNDP study is timely for xf0 x9f x87 xa7 xf0 x9f x87 xb9 for raising awareness amp for a climate smart forest policy amp practices , pnamgyel , ,631,Thimphu 
2020-08-03 03:10:50, NaeemQureshi87 Get your facts correct regarding Bhutan and her relationships with her neighboring countries You may simply google it , kuenzakarma , ,1380,Thimphu 
2020-08-03 03:07:28, gulaboo39 Can you shed some light on your statement It seems really interesting me being from Bhutan and all , kuenzakarma , ,1380,Thimphu 
2020-08-03 02:30:12, xf0 x9d x97 xac xf0 x9d x97 xbc xf0 x9d x98 x82 xf0 x9d x97 xbf xf0 x9d x97 xb0 xf0 x9d x97 xae xf0 x9d x98 x80 xf0 x9d x97 xb5 xf0 x9d x97 xb0 xf0 x9d x97 xae xf0 x9d x97 xbb xf0 x9d x97 xb4 xf0 x9d x97 xb2 xf0 x9d x98 x81 xf0 x9d x98 x80 xf0 x9d x98 x81 xf0 x9d x97 xbc xf0 x9d x97 xb9 xf0 x9d x97 xb2 xf0 x9d x97 xbb xf0 x9d x97 xbc xf0 x9d x97 xbf xf0 x9d x97 xb9 xf0 x9d x97 xbc xf0 x9d x98 x80 xf0 x9d x98 x81 xf0 x9d x97 xa8 xf0 x9d x98 x80 xf0 x9d x97 xb2 xf0 x9d x97 xb2 xf0 x9d x97 xa7 xf0 x9d x97 xb2 xf0 x9d x97 xb2 xf0 x9d x97 xbf xf0 x9d x98 x82 xe2 x80 x93 xf0 x9d x97 x9e xf0 x9d x97 xb2 xf0 x9d x97 xb2 xf0 x9d x97 xbd xf0 x9d x97 xb6 xf0 x9d x98 x81 xf0 x9d x98 x80 xf0 x9d x97 xb6 xf0 x9d x97 xba xf0 x9d x97 xbd xf0 x9d x97 xb9 xf0 x9d x97 xb2 xf0 x9d x97 xae xf0 x9d x97 xbb xf0 x9d x97 xb1 xf0 x9d x98 x80 xf0 x9d x97 xae xf0 x9d x97 xb3 xf0 x9d x97 xb2 For more info visit https t co CKCGwoAwNu TashiCell AppSecurity ePaymentsWitheTeeru https t co x5mo65IcIS , TashiCell , TashiCell AppSecurity ePaymentsWitheTeeru ,1765,Thimphu 
