2020-09-10 07:01:10, You may be in the role of confidante or therapist today as a f More for Sagittarius https t co FfKav1h4Nc , kintsho bht , ,30,Thimphu 
2020-09-10 07:01:02, Today you are being called to integrate your spiritual ideals More for Taurus https t co EECfQYA8HL , cixx67 , ,1506,Thimphu 
2020-09-10 07:00:15, Today is a magnificent opportunity for beautifying your home a More for Pisces https t co uojyhA9mo8 , LobzangYeshey1 , ,314,Thimphu 
2020-09-10 06:58:15, Animal husbandry and breed management goes digital PM narendramodi to launch e Gopala app and Pradhan Mantri Matsya Sampada Yojana on 10 September 2020 Read more details here https t co HIvJxMKxfR xe2 x80 xa6 PMOIndia MEAIndia AgriGoI IndianDiplomacy WIONews PIB India https t co hTlFOetPkd , Indiainbhutan , ,11370,Thimphu 
2020-09-10 06:53:05, ChelseaFC What about Malang sarr , UgyenTobgyel , ,114,Thimphu 
2020-09-10 06:46:16, qiyana Just R , PKzY3 , ,2,Thimphu 
2020-09-10 06:24:05, To all Bhutanese friends please participate in Gandhi 150 Art Competion organised by Embassy of India Thimphu https t co e1qoL1HfL1 , Ashishdabas19 , ,17,Thimphu 
2020-09-10 05:51:45, caricatured xf0 x9f xa4 xa3 xf0 x9f xa4 xa3 xf0 x9f xa4 xa3 it s a blast xf0 x9f x98 x82 xf0 x9f x98 x82 , vikrantparate , ,22,Thimphu 
2020-09-10 05:42:22, Competition times are here again this time it xe2 x80 x99s art In the backdrop of Gandhi 150 EOI amp the National Institute for Zorig Chusum announce an art competition showcasing the linkages b w Gandhiji amp UN SDGs Please see details at https t co oFZjwRF0A4 PMBhutan FMBhutan https t co C9IUSpa55G , Indiainbhutan , ,11370,Thimphu 
2020-09-10 04:57:51, Thank you their Majesties for tireless working for keeping all Bhutanese safe from the current pandemic bhutan kingjigme COVID19 kingofbhutan https t co wCLP0ogTMD , jignor7 , bhutan kingjigme COVID19 kingofbhutan ,111,Thimphu 
2020-09-10 04:55:15, No gas at two of the popular outlets in Thimphu Motithang And Chubachu BODs KuenselOnline BBSBhutan thebhutanese Energy shortage , Khampaa , ,3824,Thimphu 
2020-09-10 03:47:21, Department of Agricultural Marketing and Cooperatives Annual Report 2019 20 is available online https t co a15yiYjJAN https t co OcDDW23WQD , moafbhutan , ,485,Thimphu 
2020-09-10 03:44:40, National Soil Service Centre Annual Report 2019 20 is available online https t co hTlkyBJJ6l https t co AzdcTcfU50 , moafbhutan , ,485,Thimphu 
2020-09-10 03:08:20, karen tshering I tweeted the same yesterday , namgayzam , ,24161,Thimphu 
2020-09-10 03:03:27, A nostalgic image of World Suicide Prevention day 2019 Let us work in advocating against suicide suicide WorldSuicidePreventionDay worldsuicidepreventionday2020 RTC https t co wIxOn3YIBw , NaturalistKumar , suicide WorldSuicidePreventionDay worldsuicidepreventionday2020 RTC ,43,Thimphu 
2020-09-10 02:53:30, Great message here Wonderful paper by PeteOSullivanPT amp jpcaneiro https t co idgUz901mB , monutamang , ,320,Thimphu 
2020-09-09 19:04:44, namgayzam Trump might win peace prize xf0 x9f x98 x82 xf0 x9f x98 x82 , dorji yenten , ,22,Thimphu 
2020-09-09 19:03:49, COVID 19 update from Bhutan xf0 x9f x87 xa7 xf0 x9f x87 xb9 Stay Safe xf0 x9f x99 x8f Thimphu Bhutan https t co HxclXDWFSS , bhutan majestic , COVID ,1148,Thimphu 
2020-09-09 18:18:34, GcwaOnline Druk have applied to your federation of entertaining wrestling Please let Druk know your decision on his fate Or the fate of all you have roster HA HA HA , BhutanBeast , ,33,Thimphu 
2020-09-09 18:08:49, Here xe2 x80 x99s my silver lining for 2020 https t co acJXeM6KOL , namgayzam , ,24161,Thimphu 
2020-09-09 17:59:44, First Donation Thank You for donating Blood There is no substitute for blood it only comes from generous donors like You Please continue this Noble Act Stay Home Stay Safe Message from RGoB xf0 x9f x87 xa7 xf0 x9f x87 xb9 https t co X8arBsVxNS , NaturalistKumar , ,43,Thimphu 
2020-09-09 17:54:49, phuntsho karma And Lams and even Rinpoches of dubious origin , sandeeps13 , ,280,Thimphu 
2020-09-09 17:34:22, thebiiddhya Ya 2020 is a scene full of climax and comedy Lol , NaturalistKumar , ,43,Thimphu 
2020-09-09 17:31:56, thebiiddhya That is a new game in 2020 Haha , NaturalistKumar , ,43,Thimphu 
2020-09-09 17:08:59, Personally I ll never forget this goal Just around 5 minutes following the goal in 2011 thimphu experienced earthquake Elation to panic in secs It was a terrifying experience but just like goal the quak the panic it s all ephemeral SpursOfficial coys THFC https t co fbJZiyTKPH , Tobgay333 , coys THFC ,50,Thimphu 
2020-09-09 15:52:16, SaketGokhale xe0 xa4 xab xe0 xa4 xbe xe0 xa4 x9f xe0 xa4 xb2 xe0 xa5 x80 xe0 xa4 xac xe0 xa4 x98 xe0 xa4 xbe She is the person who want hear and enjoy her own echo They cannot digest criticism , vikrantparate , ,22,Thimphu 
2020-09-09 15:26:15, I thought Trump xe2 x80 x99s nomination for the Nobel Peace Prize was fake news xf0 x9f x98 xb1 , namgayzam , ,24161,Thimphu 
2020-09-09 15:17:25, satishacharya He is postman infact we should say poor reporting by mentality bankrupt reporters , vikrantparate , ,22,Thimphu 
2020-09-09 15:14:56, LhendupDema Haha u think so , Norbu12 , ,49,Thimphu 
2020-09-09 14:12:55, Druk ready to make money Make it rain on Druk GiveMeAJob RPfeds IWillBeYourChampon , BhutanBeast , GiveMeAJob RPfeds IWillBeYourChampon ,33,Thimphu 
2020-09-09 13:19:10, Update A rumour circulating on social media stating that there will be another lockdown in the country beginning 11th September 2020 is NOT TRUE We request the public to please refrain from panic buying and xe2 x80 xa6 https t co 7PpXG1TzLE , MoHBhutan , ,1684,Thimphu 
2020-09-09 13:04:24, youneshh I am really concern on injury , TheFPLBhutan , ,14,Thimphu 
2020-09-09 11:44:49, tweetsvirat RoadsOfMumbai Extraordinary journalism xf0 x9f x98 x82 xf0 x9f x98 x82 xf0 x9f x98 x82 , vikrantparate , ,22,Thimphu 
2020-09-09 09:22:54, kinzaktc Delightful xf0 x9f x98 x8d , bista geeta , ,5,Thimphu 
2020-09-09 09:20:00, ShinyAqsa great post Aqsa https t co howjbPJOEY , SyedSaa1 , ,1548,Thimphu 
2020-09-09 09:19:37, Making use of leisure time during lock down becoming self made Interior Designer https t co oBY0Iz5byV , bista geeta , ,5,Thimphu 
2020-09-09 09:14:21, Soon after national lock down The feeling of fresh touch https t co Ou387OtYXw , bista geeta , ,5,Thimphu 
2020-09-09 09:09:41, The Nyamroos from Super Zone 4 CHANGBANGDU Before amp After Covid 19 Test Stay Safe xf0 x9f x99 x8f Disclaimer We removed both the Mask amp Face Shield for quick photo shoot Photo taken at our Base Thimphu Bhutan https t co QZZhseoFWJ , bhutan majestic , ,1148,Thimphu 
2020-09-09 09:09:18, 9th Sept Covid 19 Test Thimphu Bhutan https t co SUQwzfqzFz , bhutan majestic , ,1148,Thimphu 
2020-09-09 08:45:24, AdvocacyMaterials Towards ensuring the New Normal at Construction Source Ministry of Health https t co RmMTX3oAXJ , moafbhutan , AdvocacyMaterials Source ,485,Thimphu 
2020-09-09 08:09:14, All the restaurants cafes hotel owners can print the new normal infographic for restaurants and food handlers and display the same in their respective business areas for strict compliance by the employees xe2 x80 xa6 https t co psFNNxXdat , KuenselOnline , ,47947,Bhutan 
2020-09-09 07:06:45, Help me with this awesome competition from https t co URkrKCIshr and https t co vavcSNLPM0 https t co cIVeYeBPHl https t co lwZyec5CvB , gili6aue , ,48,Bhutan 
2020-09-09 07:01:10, Today affords you an opportunity to demonstrate your deep inte More for Sagittarius https t co FfKav1h4Nc , kintsho bht , ,30,Bhutan 
2020-09-09 07:01:02, You are a natural artisan gifted with an aesthetic touch and More for Taurus https t co EECfQYA8HL , cixx67 , ,1506,Thimphu 
2020-09-09 07:00:16, Today you are especially optimistic about your future and conf More for Pisces https t co uojyhA9mo8 , LobzangYeshey1 , ,314,Thimphu 
2020-09-09 05:57:03, yuukaM Loved so gorgeous , 2kPai , ,18,Paro 
2020-09-09 05:47:04, AdvocacyMaterials Towards ensuring the New Normal at High Risk Communities and Towns Source Ministry of Health https t co Ep0YsfGzHS , moafbhutan , AdvocacyMaterials Source ,485,Thimphu 
2020-09-09 05:30:54, AnannyaB1 anu jironi I know A friend in Nepal sent it to me lol , namgayzam , ,24161,Thimphu 
2020-09-09 04:35:05, Attending APNIC50 first timer https t co T8ceG0V5Qn , pratimaIceberg , APNIC50 ,142,Thimphu 
2020-09-09 04:08:21, covid19update Bhutan another FrontLiner a 28 yr RBP personnel tests positive in Phuntsholing My sympathy for ALL frontliners in Bhutan , kuenzakarma , covid19update Bhutan FrontLiner Phuntsholing Bhutan ,1393,Thimphu 
2020-09-09 04:02:59, NOTIFICATION Requesting all the restaurants cafes hotel owners to print the New Normal infographic for restaurants and food handlers and display the same in your respective business areas for strict compliance by xe2 x80 xa6 https t co pk3pww5WRY , MoHBhutan , ,1684,Thimphu 
2020-09-09 03:46:58, It s a beautiful day here in Bhutan amidst the pandemic good day to everyone xf0 x9f x8c xb8 xf0 x9f x8c xb8 xf0 x9f x8c xb8 , Tsherin01031084 , ,4,Thimphu 
2020-09-09 03:45:19, mani dem08 It won t be for the antis , Tsherin01031084 , ,4,Thimphu 
2020-09-09 03:44:23, When the best hikes are just around your neighbourhood Looking forward to be able to scale the peaks and mountain ridges of Thimphu again Chhokhortse TemplesOfThimphu HikesAndTrails Thimphu Bhutan https t co tMikgKLYhn , LovenRamos , Chhokhortse TemplesOfThimphu HikesAndTrails ,2125,Bhutan 
2020-09-09 03:41:11, mani dem08 B hundred Hyun ArianaGrande Me too xf0 x9f x98 x8a , Tsherin01031084 , ,4,Thimphu 
2020-09-09 03:39:55, Move around with TashiCell MiFi amp Create your own WiFi zone wherever you go Available from Customer Care Center Thimphu Learn More https t co PhVvkLnTfV bhutan tashicell mifi pocketwifi https t co 3StKGGgE3E , TashiCell , bhutan tashicell mifi pocketwifi ,1811,Thimphu 
2020-09-09 03:38:16, Get access to your account transactions without visiting branches through Statement option in mBoB not only for Savings Current amp Overdraft account but also for Loan and Recurring Deposit accounts EnjoyBankingOnYourFingertips https t co AMSZVYHbGa , BankofBhutan , Statement mBoB EnjoyBankingOnYourFingertips ,1495,Thimphu 
2020-09-09 03:21:03, I vote Louis Tomlinson Louis Tomlinson as ArtistoftheSummer of 2020 965TDY , Tsherin01031084 , ArtistoftheSummer ,4,Thimphu 
2020-09-09 03:13:23, mani dem08 Sure Alot more xf0 x9f x98 x82 , Tsherin01031084 , ,4,Thimphu 
2020-09-09 03:04:41, Governing with Artificial Intelligence https t co X0N2jhCoJE , sangaykhandu , ,8052,Thimphu 
2020-09-09 01:38:16, After 21 days of lockdown and a cautious easing after that strict covid 19 safety protocol and general public adhering to the rules laid down by government and agencies Bhutan might wipe out the virus out of the xe2 x80 xa6 https t co Z2pL1jpG3W , Swallowtail2014 , ,390,Thimphu 
2020-09-09 00:59:10, Absolutely bad news for pi haters You are already late Click this link and get your app https t co KnXEdsbR5V https t co KDYBsvJNXN , ragusubedi , ,1017,Thimphu 
2020-09-08 18:59:45, SamsungMobile BTS twt Exciteddddd , pixie simpson93 , ,26,Thimphu 
2020-09-08 18:57:18, https t co aPEAtdVPDW birthday of my grand daughter , SyedSaa1 , ,1548,Thimphu 
2020-09-08 18:23:46, So much to learn , alwaysSora , ,5,Thimphu 
2020-09-08 18:22:23, Hurt people hurt others hustlers , alwaysSora , hustlers ,5,Thimphu 
2020-09-08 17:58:14, GakiTenzin Don xe2 x80 x99t make lots of friends unless you xe2 x80 x99re joining a political party xf0 x9f x98 x82 , Phuuuuubz19 , ,852,Thimphu 
2020-09-08 17:32:47, xe2 x98 x9d xef xb8 x8f it happened xe2 x9c x8c xef xb8 x8f it repeated xe2 x98 x9d xef xb8 x8f xe2 x9e x95 xe2 x9c x8c xef xb8 x8f I won xe2 x80 x99t let xe2 x80 x98it xe2 x80 x99 be a pattern 30 002 , gili6aue , ,48,Thimphu 
2020-09-08 16:45:07, My journey is start https t co n51wzsw2hF , 2kPai , ,18,Paro 
2020-09-08 16:26:43, yuukaM Wow so delicious , 2kPai , ,18,Paro 
2020-09-08 16:25:23, Not wearing glasses hurts but wearing glasses hurts even more xf0 x9f x99 x81 If headache was a human being then would have beaten it to death xf0 x9f x98 x85 headache work postlockdown , ha na 08 , headache work postlockdown ,866,Thimphu 
2020-09-08 16:16:33, LatoyaFerns clubdemadrid lwangchuk1 namgayzam SonamWongmo RahulGandhi priyankagandhi satyajeettambe srinivasiyc brijdutt Happy Birthday la , pnamgyel , ,675,Thimphu 
2020-09-08 16:12:41, If this acoustic version of CS is Swift xe2 x80 x99s 40th best song what xe2 x80 x99s her magnum opus xf0 x9f x92 xa5 https t co 0NZRtfZDyE , sandeeps13 , ,280,Thimphu 
2020-09-08 16:07:29, yuukaM Wow so gorgeous love u yukkam xe2 x9d xa4 xef xb8 x8f xe2 x9d xa4 xef xb8 x8f xf0 x9f x92 x8b xf0 x9f x92 x8b xf0 x9f x92 x8b xf0 x9f x92 x8b xe2 x9d xa4 xef xb8 x8f xe2 x9d xa4 xef xb8 x8f xe2 x9d xa4 xef xb8 x8f , 2kPai , ,18,Paro 
2020-09-08 16:02:07, Exploring different types of food Shabalay lockdown special Stay safe https t co HPRKE1ogzP Bhutan NewNormal2020 foodie Shabalay foodies foodfantasy eatclean eatlocal traveltips foodtips https t co NhkfdIEHu1 , worldtourplan09 , Bhutan NewNormal2020 foodie Shabalay foodies foodfantasy eatclean eatlocal traveltips foodtips ,193,Thimphu 
2020-09-08 15:00:34, BTS twt Wow so overwhelmed by the overwhelming reaction you guys gave xf0 x9f x98 xad xf0 x9f x98 xad xf0 x9f x98 xad xf0 x9f x98 xad armys crying rn , Scarlet bunny , ,137,Thimphu 
2020-09-08 14:39:24, RuchiraKamboj Thanks Maam , Wangdugey , ,30,Thimphu 
2020-09-08 14:28:02, SIX things NOT to do when wearing a face covering https t co Na6vVGaotl , ChhedupSangay , ,1148,Thimphu 
