2020-09-17 10:33:57, The Hon xe2 x80 x99ble Sanam Lyonpo Yeshey Penjor met His Excellency Mr Barry O xe2 x80 x99Farrel the Australian Ambassador to Bhutan today virtually https t co sWhlDuTHQq https t co lQY06QAtF9 , moafbhutan , ,485,Thimphu 
2020-09-17 09:23:24, yontenphuntsho9 He can xe2 x80 x99t harm you Guarantee xf0 x9f x92 xaf per cent , DziJ , ,1746,Thimphu 
2020-09-17 09:23:14, Turn your eyes to the sky Thank you IgnazioMagnani Ignazio for the tip to see the International Space Station at 6 35 pm this evening in Bhutan technology InternationalSpaceStation PMOIndia PMBhutan FMBhutan MEAIndia IndianDiplomacy DITTBHu BBSBhutan KuenselOnline https t co ab9eGWaniP , Indiainbhutan , technology InternationalSpaceStation ,11369,Thimphu 
2020-09-17 09:17:32, On 6 September an agreement was signed between the DepartmentofForestsandParkServices and the GreenBhutanCorporationLimited on implementation of plantation program https t co 9uTpV6oznq https t co GGMsrVQev3 , moafbhutan , DepartmentofForestsandParkServices GreenBhutanCorporationLimited ,485,Thimphu 
2020-09-17 08:30:59, Life is all again about another miles stone My Collection https t co UpNFIhMxAZ , bista geeta , ,5,Thimphu 
2020-09-17 08:30:37, Something stinks to the high heavens in the Multi Level Car Parking project in Thimphu Something thebhutanese has been pointing out since 2016 https t co FSQ2ptpZIF , TenzingLamsang , ,24456,Thimphu 
2020-09-17 08:28:22, The itinerant Nomads of Bhutan inhabiting the regions of Gasa fortified 2950 meters above the Sea level The paradigmatic conception of hedonism is utterly inexistent to them and are still bound to the rudimentary conventions Their dialects and apparels are resplendently unique https t co qg50mIvfXH , BrezzyNemo , ,20,Thimphu 
2020-09-17 08:06:55, If you ever get lazy to dress prestentably in the morning remember that if you die that day that s going to be your GHOST OUTFIT xf0 x9f x98 xb1 ThursdayThoughts , ImihcWangmo , ThursdayThoughts ,371,Thimphu 
2020-09-17 07:42:30, Do you remember when you joined Twitter I do MyTwitterAnniversary https t co lf6cqXeJMW , DeeCeeChokey , MyTwitterAnniversary ,80,Thimphu 
2020-09-17 07:02:28, Your creative self expression is flourishing as you find the c More for Virgo https t co ytH6jMhay1 , czdorji , ,2313,Thimphu 
2020-09-17 07:01:18, Following the case of the 18 year old girl from Samdrupjongkhar active mass surveillance of the cluster associated with her primary contacts is being conducted in Samdrupjongkhar says MOH , ChhedupSangay , ,1148,Thimphu 
2020-09-17 07:01:09, You d be wise to get objective about your goals and expectatio More for Sagittarius https t co FfKav1h4Nc , kintsho bht , ,30,Thimphu 
2020-09-17 07:01:01, You feel deeply inspired to learn and expand your horizons tod More for Taurus https t co EECfQYA8HL , cixx67 , ,1506,Thimphu 
2020-09-17 07:00:15, An inspiring friend may catalyze a revelation about a deep psy More for Pisces https t co uojyhA9mo8 , LobzangYeshey1 , ,314,Thimphu 
2020-09-17 06:55:29, Memories to be cherish thankyouyourmijesty xf0 x9f x99 x8f xf0 x9f x99 x8f xf0 x9f x99 x8f https t co Uvp4Y917sW , SonamZa75499076 , thankyouyourmijesty ,1,Thimphu 
2020-09-17 05:45:35, yontenphuntsho9 It xe2 x80 x99s all in the head xe2 x80 x9cRang sem Karpo sey mena yidam lha lay ka choe May xe2 x80 x9d means if your conduct is pure and hasn xe2 x80 x99t done any evil onto others no one can harm you Your mind is the black white magician , DziJ , ,1746,Thimphu 
2020-09-17 05:37:20, badgers124 Kane is captain America and bale is iron man , phuzinspurs , ,1271,Thimphu 
2020-09-17 05:19:25, VocalforLocal Khadi and Village Industry Commission xe2 x80 x99s KVIC has a pan India reach enabling artisans sell their products to the remotest parts of India through the KVIC e Portal https t co Uh2fbKHHXP Digital Khadi PMOIndia MEAIndia smritiirani TexMinIndia https t co LqkoxbM8qv , Indiainbhutan , VocalforLocal Digital Khadi ,11369,Thimphu 
2020-09-17 05:12:51, Charting out a new path in mygovindia s Mission Education for All through the NEP2020 NationalEducationalPolicy2020 PMOIndia PiyushGoyal EduMinOfIndia MEAIndia IndianDiplomacy PIB India PBNS India DDNewslive DDNewslive WIONews livemint KuenselOnline BBSBhutan https t co qvdeDl0X2K , Indiainbhutan , NEP2020 NationalEducationalPolicy2020 ,11369,Thimphu 
2020-09-17 04:54:34, Book Your TashiCell Prepaid SIM Card Online amp Get it Delivered at Home in Thimphu No delivery charge amp COD is available To Book https t co dP6a2n23y8 tashicell booksim bhutan https t co 4PAN27MxJE , TashiCell , tashicell booksim bhutan ,1811,Thimphu 
2020-09-17 04:52:49, AIforAll RAISE 2020 Responsible AI for Social Empowerment a Global Summit on ArtificialIntelligence by GoI MeitY is scheduled to held virtually from 5 9 October xe2 x80 x98AI xe2 x80 x99 Solution Challenge launched to promote innovative AI solutions in India AI PMOIndia GoI MeitY https t co pyv6EONVRV , Indiainbhutan , AIforAll ArtificialIntelligence AI AI ,11369,Thimphu 
2020-09-17 04:32:59, artiprakash Vibhinnaideas Ones journalism had ethics and people used to call it anti establishment media now ethics gone and it is known as Godi Media xf0 x9f x98 x80 , vikrantparate , ,22,Thimphu 
2020-09-17 03:58:56, A shitty old Samsung phone and Twitter with constant refreshing for the last 23 hours for any Bale confirmation is giving me radiation burn on my left palm Get it done SpursOfficial , phuzinspurs , ,1271,Thimphu 
2020-09-17 03:55:06, Relax https t co 8PL2Eh4Hvl , dorjye , ,39,Thimphu 
2020-09-17 03:50:27, Our journey towards Digitization Research and write up by Passang Norbu Head PR and Media Thimphu Corporate Office https t co G1aaTUCjO8 , BankofBhutan , ,1495,Thimphu 
2020-09-17 03:42:33, artiprakash Vibhinnaideas Rightly Said , vikrantparate , ,22,Thimphu 
2020-09-17 03:41:39, Happy Birthday your Excellency shri Narendra Modi ji , bista geeta , ,5,Thimphu 
2020-09-17 03:23:59, BtsPrisarang Who is that heart breaker xf0 x9f x98 x82 , PemaDeki18 , ,10,Thimphu 
2020-09-17 03:16:50, Marked as to read Looking for Alaska by John Green https t co e5mK0Ir1P7 , pratimaIceberg , ,142,Thimphu 
2020-09-17 03:05:26, IamKingClown So the truth about girls is that they are true , BidhaChencho , ,116,Paro 
2020-09-17 02:52:09, passangyt Use gmail organizer and filters , Tobgay3 , ,109,Paro 
2020-09-17 02:37:27, Life in between the mountains the clouds the prayer flags and Himalayan dreams Thimphu Bhutan FarewellToSummer Thimphu Bhutan https t co efRqOUYXSa , LovenRamos , Thimphu Bhutan FarewellToSummer ,2125,Bhutan 
2020-09-17 01:35:28, As part of Gandhi 150 birth anniversary celebrations ICCR amp Upid Msme are hosting a Webinar Weaving Relations Textile Traditions on 3 October 2020 at 10 00 am textiletraditions PMOIndia MEAIndia ICCR Delhi WIONews livemint PIB India IndianDiplomacy PBNS India https t co fWtOnnKkNM , Indiainbhutan , ICCR textiletraditions ,11369,Thimphu 
2020-09-16 22:33:34, Progress is Change 5 Steps To A Progressive Organizational Structure r https t co UMDpegigOa corporaterebels corp rebels , TingKarr8 , Progress Change corporaterebels ,38,Thimphu 
2020-09-16 19:14:49, steppeherbs JAHDJSJF EXCUSE ME MESODHEHFHJDBFBF , Caniiibal , ,152,Thimpu 
2020-09-16 16:54:24, chokilha You the best tae wai I didn t even think of this , UgyentsK , ,93,Thimpu 
2020-09-16 16:46:39, chokilha We the best mates I had fun too Lovechu and chuki , UgyentsK , Lovechu chuki ,93,Thimpu 
2020-09-16 16:21:14, Finally they make it public https t co xL9wzDT7FW , ChhedupSangay , ,1148,Thimphu 
2020-09-16 16:13:06, They have been the antique sentinels of the Himalayas for bygone eras The name of this specimen of regal dogs depend variantly upon the distinctive dialects of the world but for the nonce this imposing breed is ubiquitously monkiered as the Tibetan Mastiff Mastiffsof xf0 x9f x87 xa7 xf0 x9f x87 xb9 amp xf0 x9f x87 xb3 xf0 x9f x87 xb5 https t co QP8zou0DDx , BrezzyNemo , Mastiffsof ,20,Thimphu 
2020-09-16 16:11:03, Lunana Yak in the Classroom Where can I watch , ChhedupSangay , ,1148,Thimphu 
2020-09-16 16:09:07, passangyt Yes Just click and tweet xf0 x9f x98 x9c , ChhedupSangay , ,1148,Thimphu 
2020-09-16 14:57:13, deeprajchhetri Did exactly that and that smell went inside my mouth also xf0 x9f x98 x96 , zzezenn , ,2052,Thimphu 
2020-09-16 14:32:53, Do you think you know India well Prove it Participate in the BharatKoJaniye 2020 21 quiz organised by MEAIndia Winners will be invited to tour India Registrations open 30 Sept 2020 on https t co W8yhrOUUqr quizzing BharatKoJaniye PMOIndia MEAIndia WIONews https t co gZSkovQhMH , Indiainbhutan , BharatKoJaniye India quizzing BharatKoJaniye ,11369,Thimphu 
2020-09-16 14:24:07, Pleased to virtually meet the newly accredited Australian Ambassador to Bhutan H E Mr Barry O xe2 x80 x99Farrell today Discussed range of priorities to further promote and strengthen the excellent ties between our two countries Looking forward to welcoming His Excellency to Bhutan soon https t co O68cOI7h5e , FMBhutan , ,4120,Thimphu 
2020-09-16 14:17:23, zhonba Oops xf0 x9f x99 x8a but you know that feeling right xf0 x9f x98 x82 , zzezenn , ,2052,Thimphu 
2020-09-16 14:14:44, Youth in agribusiness shaping the future of agriculture ppt download https t co ErqYUaAXih , karmat bhutan , ,298,Thimphu 
2020-09-16 14:11:18, zzezenn Wai I am eating sa xf0 x9f x98 x9e xf0 x9f x98 xad , zhonba , ,1676,Thimphu 
2020-09-16 14:11:07, HChhawsaria rohini sgh Accepting mistake shows your maturity and education Sorry for my comment Brother , vikrantparate , ,22,Thimphu 
2020-09-16 14:05:45, Involving the Youth in Agricultural Development ppt download https t co BvTEc2vtvG , karmat bhutan , ,298,Thimphu 
2020-09-16 14:05:14, drukanddrukpa Those were another time a diff kind of charm xf0 x9f x99 x82 , zzezenn , ,2052,Thimphu 
2020-09-16 13:58:08, AshishXL rohini sgh BJP s strategy in modi Shah regime is to shake hand with regional player where ever they are weak and finish them slowly by increasing support base Same happened in Maharashtra Let s see what is going to happen in Bihar after this election , vikrantparate , ,22,Thimphu 
2020-09-16 12:45:48, XyzaCruzBacani Wishing you Merry Christmas 100 days in advance xf0 x9f x8c xb8 , Phuuuuubz19 , ,852,Thimphu 
2020-09-16 12:42:03, Kenchoo7 when that smell enters your mouth in huge waves lol , zzezenn , ,2052,Thimphu 
2020-09-16 12:26:46, beauty in Saree https t co Zjk9ZPtdnZ , SyedSaa1 , ,1548,Thimphu 
2020-09-16 12:23:54, Fact I am the most creative and the person with the strongest memories xf0 x9f x98 x82 , BidhaChencho , ,116,Paro 
2020-09-16 12:17:04, Its been a while sice that day but i still feel like its yesterday People say it s a matter of time but it still vivid here in my mind Wishing for a deprive of a memory Yeah Just one , BidhaChencho , ,116,Paro 
2020-09-16 11:11:41, Contest Participate in WeavingTraditions contest by sharing a 3 minute high resolution video focusing on unique design traditional formulations combinations of fabrics floral or tribal motifs or unique embroidery of textiles amp stand a chance to win attractive prizes https t co wJ6Tae4wB7 , Indiainbhutan , Contest WeavingTraditions ,11369,Thimphu 
2020-09-16 11:08:18, Marked as to read The Silk Roads by Peter Frankopan https t co xZpDpGcKNs , pratimaIceberg , ,142,Thimphu 
2020-09-16 10:59:23, Spyyyyy2 So cute Tweet xf0 x9f x92 x93 xf0 x9f x92 x93 xf0 x9f x92 x93 I want to see you cute fattty chubby cheeks in a hoddie , dorjye , ,39,Thimphu 
2020-09-16 10:53:43, Good Evening from BhutanTravel xf0 x9f x87 xa7 xf0 x9f x87 xb9 bhutan COVID19 happy https t co JWeLjQED4O , NamgaySkidas , bhutan COVID19 happy ,347,Paro 
2020-09-16 10:51:27, twangchuk23 In recent televised speech His Majesty told us how we are blessed with abundance of water but we xe2 x80 x99re hardly able to source it for household use and irrigation Whose failure is it anyway , Khampaa , ,3824,Thimphu 
2020-09-16 10:41:30, Yesterday it was Chilies Today it is Tomatoes and Onions What shortage will tomorrow bring to Bhutan Lets see what visionary leadership will MoAF minister and secretary show Bhutan , kuenzakarma , Bhutan ,1393,Thimphu 
2020-09-16 10:18:46, Have you heard of Puthka honey In Bhutan it is known for its anti biotic values and is used for the treatment of sore throat asthma allergies stomach ulcers and many more etsy superfood https t co pPSCiFXIGn , tasteofbhutan , honey Bhutan etsy superfood ,2,Thimphu 
2020-09-16 10:15:37, SaamduCh The Seven Habits that you tough us indeed i am making use of it every day Thank you sir , bista geeta , ,5,Thimphu 
2020-09-16 10:12:03, SaamduCh This is extra miles Keep it up sir , bista geeta , ,5,Thimphu 
2020-09-16 10:01:54, rich chandler ThePerchy FabrizioRomano He is just looking for hits , phuzinspurs , ,1271,Thimphu 
2020-09-16 09:58:18, spurs family WhoScored With winks in same as in everton where winks will keep going side ways side ways and back ways Nothing new , phuzinspurs , ,1271,Thimphu 
2020-09-16 09:55:02, namgayzam it s not that surprising when you know that almost any politician can nominate someone It s most likely someone from his own party who nominated him and even more likely that it was at his own request , tasteofbhutan , ,2,Thimphu 
2020-09-16 09:33:32, Do read the Raksha Mantri xe2 x80 x99s statement regarding the situation on the eastern border in Ladakh https t co E4sxClUL7x PMOIndia MEAIndia rajnathsingh SpokespersonMoD PIB India PBNS India DDNewslive , Indiainbhutan , ,11369,Thimphu 
2020-09-16 09:13:21, Dragon35237107 It was too late xf0 x9f xa4 xad , zzezenn , ,2052,Thimphu 
2020-09-16 08:33:12, sonamtweetsx Hostel means too many incidents xf0 x9f xa4 xa3 , zzezenn , ,2052,Thimphu 
2020-09-16 08:26:42, That moment when entering a toilet after someone poops xf0 x9f x98 x96 xf0 x9f xa4 xa3 , zzezenn , ,2052,Thimphu 
2020-09-16 08:24:28, How Beautiful is this nature it give us everything of its own without having been asked It will change it colour so attractively that everyone loves to grab this fruits Name Persimmon https t co qVZeLK8vJA , bista geeta , ,5,Thimphu 
2020-09-16 07:39:07, JigsNews drukanddrukpa Very much happy busy mey kho xf0 x9f x98 x9c , zzezenn , ,2052,Thimphu 
2020-09-16 07:02:30, Today you may emotionally reconcile with a recent paradigm shi More for Virgo https t co ytH6jMhay1 , czdorji , ,2313,Thimphu 
2020-09-16 07:01:11, Take advantage of your ruling planet Jupiter s benevolent in More for Sagittarius https t co FfKav1h4Nc , kintsho bht , ,30,Thimphu 
2020-09-16 07:01:03, Today creative labors will help you step more fully into the More for Taurus https t co EECfQYA8HL , cixx67 , ,1506,Thimphu 
2020-09-16 07:00:15, Highly intelligent conversations with an eccentric or revoluti More for Pisces https t co uojyhA9mo8 , LobzangYeshey1 , ,314,Thimphu 
2020-09-16 06:25:02, drukanddrukpa xf0 x9f xa4 xa3 xf0 x9f xa4 xa3 stories of many , zzezenn , ,2052,Thimphu 
2020-09-16 06:05:39, Ramon Vega71 Mikalisyid SpursOfficial I stopped right after he said Harry winks , phuzinspurs , ,1271,Thimphu 
2020-09-16 06:04:02, My new signature for my PhotoGraphy with beautiful sunset https t co WbELdehfMy number8 soonamwalker SoonamWalker PhotoGraphy sun sunset india westbengal https t co de4DB4PeLA , soonamwalker , number8 soonamwalker SoonamWalker PhotoGraphy sun sunset india westbengal ,11,Thimphu 
2020-09-16 05:51:43, Presenting a few budding literary stalwarts Congratulations to all the prize winners of the essay competition Siddharth Dangi Dorji Wangmo amp Kartikye Kashyap and crossword contest Tshewang Dorji held by EOI through the online mode Crossword PMOIndia DrRPNishank https t co RRjgXIQ4bM , Indiainbhutan , Crossword ,11369,Thimphu 
2020-09-16 05:38:05, BBSBhutan May they recover soon , phuzinspurs , ,1271,Thimphu 
2020-09-16 05:32:11, UberFacts I thought bill gates died Man put the sentence in a proper manner , Xiao920 , ,95,Thimphu 
2020-09-16 05:02:01, ycrinzin ChhedupSangay RBG ARCHITECT KuenselOnline BBSBhutan thebhutanese must investigate on whether RSTA genuinely implements the vehicle fitness test I have personally noticed that fitness test is overlooked and done for the sake during blue book renewal , Khampaa , ,3824,Thimphu 
2020-09-16 04:49:09, Loved this movie xe2 x9c xa8 xf0 x9f xa7 x99 xe2 x80 x8d xe2 x99 x80 xef xb8 x8f https t co 8tN2347E12 , brooksound , ,46,Thimphu 
2020-09-16 04:33:55, My prayers for our two heros It s sad to hear that two Desuups were hit by a car It is more sad to hear that they were airlifted to Delhi May our deties be with them xf0 x9f x99 x8f xf0 x9f x99 x8f xf0 x9f x99 x8f , ChhedupSangay , ,1148,Thimphu 
2020-09-16 04:33:51, WhiteHartKane Its the journey and not the destinations The feeling you have right now will give you a smile at the end of the season you never know xe2 x98 xba cheer up buddy , phuzinspurs , ,1271,Thimphu 
2020-09-16 04:33:00, Today on the first day of Wangdue Dromchoe the Wangdue Dratshang will be livestreaming of Zhanag Ngachham and Dhegey Chham on their Facebook page from 10 30AM Likewise the Dratshang will be livestreaming Zhanag Ngamai Kunchham from 3PM https t co C5sHICRZzX , gasebtandin , ,2558,Thimphu 
2020-09-16 04:28:21, The RNR Newsletter 1 15 September Vol VIII Issue no XIII covers the story of the impacts of COVID 19 to the poultry sector in Bhutan Please click here for details https t co HCDIMx42tM https t co QN6lWdlgEc , moafbhutan , ,485,Thimphu 
2020-09-16 04:18:19, FluClinic Everyone suffering from flu like symptoms should visit the flu clinics to get treated and also screen for COVID 19 in a safe and timely manner Please know more through the advocacy video https t co ULYjERpEjP Source Ministry of Health , moafbhutan , FluClinic Source ,485,Thimphu 
2020-09-16 04:17:26, Don xe2 x80 x99t mention beautiful by view of external beauty Say beautiful by looking warm hearted and kindness Don xe2 x80 x99t say I am good men if you do not have pure heart Don xe2 x80 x99t say I am rich if you do not have genuine compassion Don xe2 x80 x99t say I am powerful if you do not help to others https t co rAy29bkIoc , ChoklangTenzin , ,24,Thimphu 
2020-09-16 04:15:20, AdvocacyMaterials Phuentsholing Yellow Zone Identified Areas and DOs DON xe2 x80 x99T xe2 x80 x99s Source Ministry of Health https t co v3W34sChd0 , moafbhutan , AdvocacyMaterials Source ,485,Thimphu 
2020-09-16 04:02:18, AdvocacyMaterials Phuentsholing Red Zone Identified Areas and DOs DON xe2 x80 x99T xe2 x80 x99s Source MoHBhutan https t co 4WHhP6wQaY , moafbhutan , AdvocacyMaterials Source ,485,Thimphu 
2020-09-16 03:05:03, HB HeadCoach Why not Sanchez in place of Dier , phuzinspurs , ,1271,Thimphu 
2020-09-16 03:02:04, xf0 x9d x97 x96 xf0 x9d x97 xae xf0 x9d x97 xbb xe2 x80 x99 xf0 x9d x98 x81 xf0 x9d x97 xb4 xf0 x9d x97 xbc xf0 x9d x98 x81 xf0 x9d x97 xbc xf0 x9d x97 xb4 xf0 x9d x98 x86 xf0 x9d x97 xba Subscribe to the TashiCell data plan and be healthier at home For more info visit https t co uGmhfpSLES TashiCell https t co CavFjAbUzJ , TashiCell , TashiCell ,1811,Thimphu 
2020-09-16 02:52:45, Starting my day with this beautiful story of an elderly woman carrying her pet an adopted stray piggyback to the vet Made my day Hope it makes yours https t co JBaeH5u758 , Kinleyshering , ,2785,Thimphu 
2020-09-16 02:30:18, passangyt will try to follow your advice Thank you la xf0 x9f x98 x8a , ha na 08 , ,866,Thimphu 
2020-09-16 02:29:20, sonamtweetsx will try to whenever there is time xf0 x9f x98 x85 , ha na 08 , ,866,Thimphu 
2020-09-16 01:07:29, When we drive can we not forget that it s not just our lives but the lives of the people in the car with us people in another car amp then people on road whose lives we re responsible for xf0 x9f x99 x8f Hope they re doing okay xf0 x9f xa4 x9e TuesdayThoughts https t co PsM8hAtZQ8 , ImihcWangmo , TuesdayThoughts ,371,Thimphu 
2020-09-15 22:52:29, purrderer YEAHHHHHHHHHHHHHHHHHHHHHHHH That took so long I m glad u finally got the reward , Caniiibal , ,152,Thimpu 
2020-09-15 21:02:18, Best freaking news ever coys thfc https t co umFvjGuTQO , Tobgay333 , coys thfc ,50,Thimphu 
2020-09-15 18:19:01, LhendupDema Gorgeous , ChoklangTenzin , ,24,Thimphu 
2020-09-15 18:17:54, LhendupDema Beautiful , ChoklangTenzin , ,24,Thimphu 
2020-09-15 18:14:59, A group of tenants has filed a lawsuit accusing Kushner Companies of illegally collecting rent and creating dangerous living conditions by failing to maintain working fire sprinkler systems in four New York City apartment buildings https t co zRysiid32t https t co cEehXKwAIg , ChhedupSangay , ,1148,Thimphu 
2020-09-15 18:10:27, ycrinzin RBG ARCHITECT OMG That s awful Thanks for update la , ChhedupSangay , ,1148,Thimphu 
2020-09-15 18:01:51, The tshechu mask dance festival celebrates the divine and the mundane and where Bhutanese flaunt their best outfits saved for this special ocassion of sanctity and festivity And one can only be amused by the radical convergence of the spiritual and material Pic pgyamtsho https t co LIRyWOpUAB , Kinleyshering , ,2785,Thimphu 
2020-09-15 17:55:59, Confucianism amp it s social stratification 1 scholar because they have the knowledge amp wisdom 2 farmers because they produced the necessary goods 3 artisans because they possessed necessary skills 4 merchants all they do is to buy amp sell things Merchants at the bottom , ChhedupSangay , ,1148,Thimphu 
2020-09-15 17:36:09, Until Covid 19 I have never realized Taj Tashi like company belong to us Without private entities and business we are nothing Similarly all other private sectors belong to us Hope things get better and better , ChhedupSangay , Covid 19 ,1148,Thimphu 
2020-09-15 17:30:37, Met a manager of a hotel He came for some marketing in my workplace What he narrate me was truly devastating He told me a big company like Taj Tashi was shut down until further notice This Covid 19 has done so much damage and it continue to do so , ChhedupSangay , Covid 19 ,1148,Thimphu 
2020-09-15 17:26:47, RBG ARCHITECT Very sad Hope they are doing well Any update on their conditions , ChhedupSangay , ,1148,Thimphu 
2020-09-15 17:25:46, With the right kind of suppport we can certainly have more Oscar entries in fact one every year And we might even win an Oscar or two who knows https t co MuPJdJqP9L , Kinleyshering , ,2785,Thimphu 
2020-09-15 17:24:31, In the Jim Hands Day Druk get ready for big matchup https t co c7G8ucLHhl , BhutanBeast , ,33,Thimphu 
2020-09-15 15:43:59, Spyyyyy2 Trusting me is a more lot life to me Having faith being trustworthy in me is like me being totally trusting you Don t press ctrl alt delete https t co dbx7S5x8lO , dorjye , ,39,Thimphu 
2020-09-15 15:41:15, My headache reached another milestone xf0 x9f xa4 x95 Had 5 PCMs headache works weekday tuesdayvibes tired , ha na 08 , headache works weekday tuesdayvibes tired ,866,Thimphu 
2020-09-15 15:37:41, KenchoTenzy never , ha na 08 , ,866,Thimphu 
2020-09-15 14:40:33, Do you pity yourself when you feel u didnt had the same privilege as your close one is having xf0 x9f xa4 x94 xf0 x9f xa4 x94 I pity myself mood works , ha na 08 , mood works ,866,Thimphu 
2020-09-15 11:46:54, Celebrating 56 years of sharing knowledge and experiences through the ITEC Programme since 1964 ITECDay ITEC56 PMOIndia MEAIndia ITECnetwork IndianDiplomacy PIB India PMBhutan FMBhutan BhutanMoea PTI News PBNS India DDNewslive https t co 6T7nGChsh6 , Indiainbhutan , ITEC ITECDay ITEC56 ,11369,Thimphu 
2020-09-15 11:33:39, DhavalSonsoil Thank you xf0 x9f x99 x82 , bista geeta , ,5,Thimphu 
2020-09-15 11:16:36, Live telecast of Zha Nag Nga Cham the sacred hat mask dance perfoming at Thimphu Tashichodzong Courtesy Zhung Dratshang facebook page https t co VyQe0zWDeh , gasebtandin , ,2558,Thimphu 
2020-09-15 11:01:57, sonamtweetsx Happy engineer day Damn four years is not joke , ha na 08 , ,866,Thimphu 
2020-09-15 10:50:12, It s the age of specialisation Doing certain jobs well Making ourselves best in the field Be a cobbler but the best in the town Today s world is the product of visualizations of somebody yesterday , ChhedupSangay , ,1148,Thimphu 
2020-09-15 10:47:15, Education is training in decision making right or wrong good or bad helpful or harmful Modern education is not about going to abstract and philosophical studies It s about finding a practical solutions to a given problem Thought of the day , ChhedupSangay , ,1148,Thimphu 
2020-09-15 09:39:43, Thimphu Tshechu is around the corner but we will have to witness the sacred mask dances virtually thanks to covid 19 maskdances thimphu https t co Yifmcy0FJl , Kinleyshering , maskdances thimphu ,2785,Thimphu 
2020-09-15 09:37:37, religion begins where logic ends and the scriptures as they were religious texts had to be believed even though they were illogical The Case that Shook India , ChhedupSangay , ,1148,Thimphu 
2020-09-15 09:27:21, Exemplary leadership https t co QVMbvywTVr , Kinleyshering , ,2785,Thimphu 
2020-09-15 09:25:21, Just posted a photo https t co LfOiLW4qkr , MoHBhutan , ,1684,Thimphu 
2020-09-15 09:23:25, I report on the Prime Minister xe2 x80 x99s four point formula to help the Bhutanese economy recovery from the COVID 19 impact https t co G8xvMAeVUG , TenzingLamsang , ,24456,Thimphu 
2020-09-15 09:08:20, LetsTalk FPL So you are planning for wildcard , TheFPLBhutan , ,14,Thimphu 
2020-09-15 09:06:18, So this story of mine on the PM sleeping on a windowsill in his office and staying away from the family for over a month during the critical national lockdown has struck a chord in Bhutan Sacrifice by Health Minister Ministers amp Civil Servants too https t co 16ryrdduQv , TenzingLamsang , ,24456,Thimphu 
2020-09-15 08:58:11, And still makes the same mistakes They ll soon throw Mou under the bus https t co iEt0JUdeFw , Tobgay333 , ,50,Thimphu 
