2020-09-13 04:22:10, And here is a lively Hindi song presented by Jharna Gurung amp Yanika Gurung music students of EOI Cultural Centre from Bhutan in the run up to HindiDiwas HindiDiwas WordOfHindi PMOIndia MEAIndia IndianDiplomacy ICCR Delhi vinay1011 DineshKPatnaik WIONews PIB India https t co 7zP51jHv24 , Indiainbhutan , HindiDiwas HindiDiwas WordOfHindi ,11369,Thimphu 
2020-09-13 03:46:10, Another morning another WordOfHindi WordOfHindi PMOIndia MEAIndia PMBhutan FMBhutan PIB India DrSJaishankar PBNS India ICCR Delhi https t co NBU6mWmnQN , Indiainbhutan , WordOfHindi WordOfHindi ,11369,Thimphu 
2020-09-12 17:36:06, FPLtips That s why I choose to follow you FPLtips , TheFPLBhutan , ,14,Thimphu 
2020-09-12 17:22:07, Translation of His Majesty s address to the nation xf0 x9f x99 x8f xf0 x9f x99 x8f xf0 x9f x99 x8f https t co nowkmtZMtd , ChhedupSangay , ,1148,Thimphu 
2020-09-12 17:19:06, Indications are that Leeds United are fun to watch LIVLEEDS , ChhedupSangay , LIVLEEDS ,1148,Thimphu 
2020-09-12 16:42:06, Come on , phuzinspurs , ,1271,Thimphu 
2020-09-12 16:36:39, The new penalty rule can easily be exploited Just saying , phuzinspurs , ,1271,Thimphu 
2020-09-12 16:25:28, apnic Sorry too late to reply I joined from Bhutan and I attended two security sessions , pratimaIceberg , ,142,Thimphu 
2020-09-12 16:15:55, thfcdxn Dont talk to him ever again Clib comes first , phuzinspurs , ,1271,Thimphu 
2020-09-12 15:40:33, First Premiere League game for the season Go Reds lfc LIVLEEDS https t co q9ReTAnlnM , ChhedupSangay , Reds lfc LIVLEEDS ,1148,Thimphu 
2020-09-12 15:27:25, Ugenomics The housing market may go bust by next year if the covid situation doesn xe2 x80 x99t abate , sandeeps13 , ,280,Thimphu 
2020-09-12 15:26:51, anilduhoon Sir General is no more army or retire army personal His profession is changed He is full time politician now How can you expect army discipline from him in current job role , vikrantparate , ,22,Thimphu 
2020-09-12 15:16:35, His Majesty xe2 x80 x99s Address after the first Lockdown https t co H5cQLnp4Ho , tsheridorji , ,238,Thimphu 
2020-09-12 15:07:16, hemangjani9 Thank you sir and yeah it was wonderful art xf0 x9f x96 xbc by peymaArtCreation , NamgaySkidas , ,347,Paro 
2020-09-12 14:40:15, olo000 This a problem created by the Indian Embassy They entertain unwarranted complaints from these labourers from the very beginning Now if they ever protest AGAIN the gates of the embassy should be opened so they can do whatever they like within the Embassy , Jagpamelen , ,522,Thimphu 
2020-09-12 14:35:40, good night dear https t co XO4yenroCH https t co 4WqVw80VT3 , SyedSaa1 , ,1548,Thimphu 
2020-09-12 14:33:22, Photo credit peymaArtCreation facebook source Long live His Majesty https t co OutkYUrGs6 , NamgaySkidas , facebook ,347,Paro 
2020-09-12 14:30:30, Ye SangYu I wish , ChadoLingpa , ,32,Thimphu 
2020-09-12 14:06:33, Headache for three consecutive days xf0 x9f xa4 x95 headache weekendvibes , ha na 08 , headache weekendvibes ,866,Thimphu 
2020-09-12 13:00:36, LCFC Excited https t co jdz6Sg7iOf , zhonba , ,1676,Thimphu 
2020-09-12 12:49:15, 3 0 to the Arsenal We are going to win the league , sandeeps13 , ,280,Thimphu 
2020-09-12 12:45:32, AjangBrokpa LCFC First match underway , zhonba , ,1676,Thimphu 
2020-09-12 12:43:35, fight , ChhedupSangay , ,1148,Thimphu 
2020-09-12 12:35:06, Looking forward to exciting EPL season and I am rooting for LCFC xf0 x9f xa4 x97 https t co mYLKgCg4Bl , zhonba , ,1676,Thimphu 
2020-09-12 12:22:56, His Majesty s speech was short and sweet It has lot of weights As HM commanded if our energy is vested towards sustainable water energy during this pandemic how beautiful that would be Come Bhutan Let s do it xf0 x9f x99 x8f xf0 x9f x99 x8f xf0 x9f x99 x8f , ChhedupSangay , ,1148,Thimphu 
2020-09-12 12:18:24, Dratsang and Monasteries will perform kurim Government civil servants military personnel institutions parents will work hard towards right against virus If Youth can come forward and serve the nation it will make difference HM , ChhedupSangay , ,1148,Thimphu 
2020-09-12 12:14:50, Youth mist come forward as always to serve the nation When we give youth an opportunity we must plan a work that they can perform HM , ChhedupSangay , ,1148,Thimphu 
2020-09-12 12:12:51, Any work should benefit our people And we need to work and plan that benefit the people HM , ChhedupSangay , ,1148,Thimphu 
2020-09-12 12:12:00, Despite virus we are working hard The biggest difference is because of peoples concern Hereafter our difference will come from our youths concern HM , ChhedupSangay , ,1148,Thimphu 
2020-09-12 12:10:03, Our students could not study as usual Our business couldn t operate as usual But I don t think of failing HM , ChhedupSangay , ,1148,Thimphu 
2020-09-12 12:08:40, Important is how we move forward Virus is new and we can t predict any This virus must go or we might continue until there s vaccine HM , ChhedupSangay , ,1148,Thimphu 
2020-09-12 12:07:08, His Majesty says The government civil servants Ministry of Health volunteers and the people of Bhutan for working hard in fight against this virus , ChhedupSangay , ,1148,Thimphu 
2020-09-12 12:06:10, His Majesty Thanked the People of Bhutan for cooperation until now specially during the lockdown , ChhedupSangay , ,1148,Thimphu 
2020-09-12 12:05:26, His Majesty the King addresses the nation It s relieving to hear His voice xf0 x9f x99 x8f xf0 x9f x99 x8f xf0 x9f x99 x8f , ChhedupSangay , ,1148,Thimphu 
2020-09-12 11:59:48, covid19updates Bhutan One RBA in Phuntsholing and two RBP personnels in Gelephu were detected positive during the last 24 hours The RBA is the contact of the Imtrat RBA case while RBPs are frontliners Meanwhile lockdown has been lifted except at the southern belt , kuenzakarma , covid19updates Bhutan Phuntsholing Gelephu ,1393,Thimphu 
2020-09-12 11:33:33, The game begins EPL is back EPL EPLFantasy EPLisBack , ugyentse , EPL EPLFantasy EPLisBack ,88,Thimphu 
2020-09-12 11:18:18, Sarbat Da Bhala do have a look at this compilation of commemorative activities undertaken by Indian Missions amp Posts abroad to mark 550yrsGuruNanak GuruNanakDevJi Google link https t co 1EiKdp2lNO xe2 x80 xa6 MEAIndia IndianDiplomacy PMOIndia MEAIndia IndianDiplomacy , Indiainbhutan , GuruNanakDevJi ,11369,Thimphu 
2020-09-12 10:45:19, Hindi is not just a language and also has deep roots in India s rich cultural heritage and shares linkages with other India languages through Sanskrit WordOfHindi PMOIndia MEAIndia IndianDiplomacy PIB India WIONews livemint PBNS India DDNewslive PTI News ICCR Delhi https t co RYsFJmdW1d , Indiainbhutan , WordOfHindi ,11369,Thimphu 
2020-09-12 10:34:13, Guru Nanak Dev ji xe2 x80 x98s universal message is peace love unity mutual respect service and dedication to all of humankind GuruNanakDevJi PMOIndia MEAIndia IndianDiplomacy ICCR Delhi WIONews livemint PTI News PIB India PBNS India https t co Ua3fah9JvA , Indiainbhutan , GuruNanakDevJi ,11369,Thimphu 
2020-09-12 09:24:49, Covid 19 update from Bhutan xf0 x9f x87 xa7 xf0 x9f x87 xb9 Stay Safe xf0 x9f x99 x8f BMT Happiness House https t co Z1NTEyeBrb , bhutan majestic , Covid ,1148,Thimphu 
2020-09-12 09:23:39, Just posted a photo BMT Happiness House https t co zkxA7ZrG0Z , bhutan majestic , ,1148,Thimphu 
2020-09-12 08:53:54, FPLtips how was lineup any changes from yesterday , TheFPLBhutan , ,14,Thimphu 
2020-09-12 08:17:33, Day Three at Super Zone One Babesa Together We Can Serve Our Community Efficiently WEARING MASK xf0 x9f x98 xb7 IS MANDATORY Help Us To Serve You Better Stay Home Stay Safe Thimphu Bhutan https t co yTjZn93K5h , bhutan majestic , ,1148,Thimphu 
2020-09-12 07:48:32, MrsCie DK you mean this https t co yWeqqKcSju , DziJ , ,1746,Thimphu 
2020-09-12 07:02:36, You xe2 x80 x99re balancing the impulse to be honored as a unique individ More for Virgo https t co ytH6jMhay1 , czdorji , ,2313,Thimphu 
2020-09-12 07:01:13, Your instincts and first impressions are strong today and you More for Sagittarius https t co FfKav1h4Nc , kintsho bht , ,30,Thimphu 
2020-09-12 07:01:05, Today the faculties of your higher mind are tuning into inform More for Taurus https t co EECfQYA8HL , cixx67 , ,1506,Thimphu 
2020-09-12 07:00:16, A spiritual gathering or community can make you feel deeply in More for Pisces https t co uojyhA9mo8 , LobzangYeshey1 , ,314,Thimphu 
2020-09-12 06:47:36, PMAYGramin focuses on women empowerment as out of total 1 14 crore houses completed approx 67 houses are either owned by women beneficiaries or under Joint wife and husband ownership PMGraminGrihaPravesh PMOIndia MoRD GOI IndianDiplomacy MEAIndia PBNS India https t co CqeH4Sr44K , Indiainbhutan , PMAYGramin PMGraminGrihaPravesh ,11369,Thimphu 
2020-09-12 06:41:55, Mission launched by PM narendramodi and mygovindia to provide everyone a Home Sweet Home PMGraminGrihaPravesh PMOIndia MEAIndia MoRD GOI IndianDiplomacy PIB India PTI News WIONews livemint harshvshringla https t co hkyTzkitKi , Indiainbhutan , PMGraminGrihaPravesh ,11369,Thimphu 
2020-09-12 06:39:18, Happiness has a new address Mr Gulab Singh from Amjaira Dhar is the beneficiary of PM Awas Yojana and he feels blessed as his mother xe2 x80 x99s dream of owning a house came true PMGraminGrihaPravesh PMOIndia MoRD GOI MEAIndia IndianDiplomacy PIB India WIONews livemint https t co RQ3WDSMhJl , Indiainbhutan , PMGraminGrihaPravesh ,11369,Thimphu 
2020-09-12 06:31:11, The future has arrived These explosive fires are our climate change wakeup call Peter Gleick https t co fv9vkfrQ4t , pnamgyel , ,675,Thimphu 
2020-09-12 05:53:46, Prayers for our frontline workers xf0 x9f x99 x8f xf0 x9f x99 x8f xf0 x9f x99 x8f https t co koRzv3fsfp , ChhedupSangay , ,1148,Thimphu 
2020-09-12 05:26:36, How timber markets can help save tropical forests https t co fBlHpf6RPu via cifor , pnamgyel , ,675,Thimphu 
2020-09-12 04:51:38, Just posted a photo Bhutan https t co D9gx3jAxEK , BMVTNT , ,65,Thimphu 
2020-09-12 04:35:31, sowfflll ChhedupSangay Agree xf0 x9f x99 x82 to the new normal , zzezenn , ,2052,Thimphu 
2020-09-12 04:29:36, sowfflll ChhedupSangay Exactly and the ad was screened on the national television , zzezenn , ,2052,Thimphu 
2020-09-12 04:03:36, JigsNews You are alys happy busy no , zzezenn , ,2052,Thimphu 
2020-09-12 04:03:00, ChhedupSangay Rem in March when the 1st case broke out amp all the people were wearing a mask There was this ad that it s not necessary to wear mask unless one is sick This is when we started to dis regard the mask we stocked up People will take time to get used to new normal I think , zzezenn , ,2052,Thimphu 
2020-09-12 03:57:11, Simple art https t co WbELdehfMy https t co UnhKO4siHY , soonamwalker , ,11,Thimphu 
2020-09-12 03:55:11, Simple clicked https t co WbELdehfMy https t co GiF767PNXj , soonamwalker , ,11,Thimphu 
2020-09-12 03:39:38, Snippets of EOI activities during August 2020 Do take a look MonthThatWas PMOIndia PMBhutan FMBhutan DrSJaishankar MEAIndia IndianDiplomacy WIONews livemint KuenselOnline BBSBhutan PIB India PBNS India DDNewslive PTI News IITKanpur iitbombay iitdelhi https t co 256R7HZGe5 , Indiainbhutan , MonthThatWas ,11369,Thimphu 
2020-09-12 03:31:26, An epitome of serenity amp solemnity Mahabodhi temple Bodh Gaya where the Lord attained enlightenment Also recognised as a UNESCO World Heritage Site since 2002 PMBhutan PMOIndia FMBhutan ICCR Delhi MEAIndia IndianDiplomacy incredibleindia WIONews livemint https t co rUfPIcQyyd , Indiainbhutan , ,11369,Thimphu 
2020-09-12 02:14:51, DelmaKarma Gorgeous , KinzangDendup1 , ,224,Thimphu 
2020-09-12 01:52:31, Daily Mail this is Chinese virologist who fled to the US after claiming Beijing covered up Covid 19 vows to publish evidence PROVING the virus is manmade and claims even non scientists will be able to verify the data https t co eyV9FKrJ6B , ChhedupSangay , ,1148,Thimphu 
2020-09-11 19:13:51, When everyday matters become breaking news know that we have crossed over a major time divider The future is here , binailama , ,523,Thimphu 
2020-09-11 19:02:11, ChhedupSangay BBSBhutan To decongest we need vendors in various zones Good to also keep a record of buyers to ensure that everything is not going for side business , binailama , ,523,Thimphu 
2020-09-11 17:40:31, Nganglam border patrolling Stay Home Stay Safe https t co EImr321nKL , DiwakStudio , ,1,Thimphu 
2020-09-11 16:34:19, bts bighit Happy birthday Namjoon You are the best leader you deserve al the love sarangay xf0 x9f x92 x9b xf0 x9f x92 x9b xf0 x9f x92 x9c xf0 x9f x92 x9c xf0 x9f x87 xa7 xf0 x9f x87 xb9 xf0 x9f x87 xa7 xf0 x9f x87 xb9 https t co AtmTlhyNRn , pixie simpson93 , ,26,Thimphu 
2020-09-11 16:33:42, BTS twt Notice me senpai https t co Ok6ZGyra5I , pixie simpson93 , ,26,Thimphu 
2020-09-11 16:33:17, BTS twt Happy Birthday Namjoon We love you be happy and healthy xf0 x9f x92 x9b Jin is epic ily xf0 x9f xa4 x97 xf0 x9f x87 xa7 xf0 x9f x87 xb9 xf0 x9f xa4 xa3 xe2 x9d xa4 xef xb8 x8f https t co 7nWzG6WWsg , pixie simpson93 , ,26,Thimphu 
2020-09-11 16:09:37, xe2 x80 x98A country is great when it worships principles and not men The glory of justice lies in being based upon principles than on any other trivial considerations xe2 x80 x99 The Case That Shook India pbhushan1 , ChhedupSangay , ,1148,Thimphu 
2020-09-11 16:06:15, Such a pity https t co PjrhI1VNeQ , ChhedupSangay , ,1148,Thimphu 
2020-09-11 14:50:32, Nigeria decides to castrate those convicted for rape of a child under 14 years of age https t co VFZWEgvA0C , ChhedupSangay , ,1148,Thimphu 
2020-09-11 14:47:50, On whether we can impose fines for not wearing face mask Health Minister was hopeful people will cooperate and wear the mask all time If we are to impose penalties there s a need for clear instructions and guidelines Otherwise enforcement officials will go haywire , ChhedupSangay , ,1148,Thimphu 
2020-09-11 13:45:00, Those meme with beautiful yet shitty lines Write some brief caption I need contexts to understand now Perhaps I am always in argument mood lately , BhattaraiYama , ,11,Thimphu 
2020-09-11 13:30:12, FridayThoughts Always a Grateful xf0 x9f x92 x9a xf0 x9f x92 x9b xf0 x9f x92 x9c https t co uNEORMwpYG , OrjiDema , FridayThoughts Grateful ,250,Thimphu 
2020-09-11 12:25:51, yuukaM Love you xf0 x9f x92 x8b xf0 x9f x92 x8b xf0 x9f x92 x8b xf0 x9f x92 x8b xf0 x9f x92 x8b , 2kPai , ,18,Paro 
2020-09-11 12:21:02, xf0 x9d x97 xaa xf0 x9d x97 xbc xf0 x9d x97 xbf xf0 x9d x97 xbf xf0 x9d x98 x86 xf0 x9d x97 xb6 xf0 x9d x97 xbb xf0 x9d x97 xb4 xf0 x9d x97 xb6 xf0 x9d x98 x80 xf0 x9d x97 xaf xf0 x9d x97 xae xf0 x9d x97 xb1 xf0 x9d x97 xb3 xf0 x9d x97 xbc xf0 x9d x97 xbf xf0 x9d x98 x86 xf0 x9d x97 xbc xf0 x9d x98 x82 xf0 x9d x97 xbf xf0 x9d x97 xb5 xf0 x9d x97 xb2 xf0 x9d x97 xae xf0 x9d x97 xbf xf0 x9d x98 x81 Keep your money in eTeeru and trust its safety For more info visit https t co pjlSyr5BSQ ePaymentsWitheTeeru TashiCell https t co pCwRdnmmbK , TashiCell , ePaymentsWitheTeeru TashiCell ,1811,Paro 
2020-09-11 11:12:26, Best time to bring everyone together teatime eveningteaandsnacks staysafe The Land of Happiness https t co xeuj3j8SQs , TaseCdenD , teatime eveningteaandsnacks staysafe ,35,Thimphu 
2020-09-11 11:01:33, apnic50 had an awesome time https t co S09qHXQ1sF , ManoJonaM , apnic50 ,183,Thimphu 
2020-09-11 10:42:20, As the species of the same genus usually have much similarity in habits and constitution and always in structure the struggle will generally be more severe between them if they come into competition with each other than between the species of distinct genera Darwin , ChhedupSangay , ,1148,Thimphu 
2020-09-11 09:48:17, xf0 x9d x90 x92 xf0 x9d x90 xae xf0 x9d x90 x9b xf0 x9d x90 xa6 xf0 x9d x90 xa2 xf0 x9d x90 xac xf0 x9d x90 xac xf0 x9d x90 xa2 xf0 x9d x90 xa8 xf0 x9d x90 xa7 xf0 x9d x90 xa8 xf0 x9d x90 x9f xf0 x9d x90 x9a xf0 x9d x90 xab xf0 x9d x90 xad xf0 x9d x90 xa2 xf0 x9d x90 x9c xf0 x9d x90 xa5 xf0 x9d x90 x9e xf0 x9d x90 xac xf0 x9d x90 x9f xf0 x9d x90 xa8 xf0 x9d x90 xab xf0 x9d x90 x91 xf0 x9d x90 x8d xf0 x9d x90 x91 xf0 x9d x90 x8c xf0 x9d x90 x9a xf0 x9d x90 xa0 xf0 x9d x90 x9a xf0 x9d x90 xb3 xf0 x9d x90 xa2 xf0 x9d x90 xa7 xf0 x9d x90 x9e xf0 x9d x9f x90 xf0 x9d x9f x8e xf0 x9d x9f x90 xf0 x9d x9f x8f https t co sViwayDC9X https t co s1mlPIPSNu , moafbhutan , ,485,Thimphu 
2020-09-11 09:00:50, mani dem08 Louis Tomlinson Absolutely Cheers for him and as well as us lt 3 I miss you bacon , Tsherin01031084 , ,4,Thimphu 
2020-09-11 08:16:47, good afternoon dear Neelam https t co bNPDqaejjH https t co yro9RIjClc , SyedSaa1 , ,1548,Thimphu 
2020-09-11 07:02:33, You are especially grounded and effective today as you approac More for Virgo https t co ytH6jMhay1 , czdorji , ,2313,Thimphu 
2020-09-11 07:01:12, Today you embody some of the highest virtues of leadership in More for Sagittarius https t co FfKav0ZtVE , kintsho bht , ,30,Thimphu 
2020-09-11 07:01:04, You may be feeling upset or vulnerable for reasons you don t c More for Taurus https t co EECfQYA8HL , cixx67 , ,1506,Thimphu 
2020-09-11 07:00:16, Tap into any feelings of pain or self doubt that may stir in y More for Pisces https t co uojyhA9mo8 , LobzangYeshey1 , ,314,Thimphu 
2020-09-11 06:41:03, thebhutanese Kudos to RGOB for such a prudent decision I do indeed concede with this act of momentarily interdicting the junior scholars from schooling as their rambunctious temperament and disposition may be detrimental to their health at the lateral stages So I ardently advocate it , BrezzyNemo , ,20,Thimphu 
2020-09-11 06:10:41, According to the International Air Transport Association IATA providing a single dose of the vaccine to 7 8 billion people will require the use of 8 000 Boeing 747 cargo aircraft and planning needs to begin now https t co bplLhWz3Ng , ChhedupSangay , ,1148,Thimphu 
2020-09-11 05:42:39, As the creator creates https t co uOmGozbzgd , ragusubedi , ,1017,Thimphu 
2020-09-11 05:21:16, Rationalization of recurrent budget for FY 2020 21 under COVID 19 situation https t co P30HKhYP0O , moafbhutan , ,485,Thimphu 
2020-09-11 04:47:41, At the Tobacco outlet in Thimphu today Pictures from BBSBhutan Facebook page https t co u9HCOIx5tw , ChhedupSangay , ,1148,Thimphu 
2020-09-11 04:34:08, Just posted a photo Thimphu Bhutan https t co FCyQJwgA0U , LovenRamos , ,2125,Bhutan 
2020-09-11 04:00:00, FCRA decision on registration of Sri Harmandir Sahib is a pathbreaking one which will once again showcase the outstanding spirit of service of our Sikh sisters and brothers SriHarmandirSahib PMOIndia AmitShah HardeepSPuri MEAIndia IndianDiplomacy PIB India PBNS India https t co xe53zhgdzz , Indiainbhutan , SriHarmandirSahib ,11369,Thimphu 
2020-09-11 03:42:38, Joint Press Statement Meeting of External Affairs Minister and the Foreign Minister of China September 10 2020 https t co X28EwenYRP PMOIndia MEAIndia DrSJaishankar EOIBeijing PIB India PBNS India PMBhutan FMBhutan DDNewslive WIONews IndianDiplomacy livemint , Indiainbhutan , ,11369,Thimphu 
2020-09-11 01:54:44, gyeltsay thats y i am more happy xf0 x9f x98 x80 I love you too xf0 x9f x98 x98 xf0 x9f x98 x98 xf0 x9f x98 x98 , ha na 08 , ,866,Thimphu 
2020-09-11 01:32:48, Just posted a photo https t co dhSxuSxaDT , Swallowtail2014 , ,390,Thimphu 
2020-09-11 01:10:35, Breaking Schools colleges and institutes Classes X and XII will resume from September 14 and Classes IX and XI will also start on campus school from September 21 Those classes in high risk areas will have to wait until the unlocking procedures are complete in those places https t co ig0Yh30Ch0 , ChhedupSangay , ,1148,Thimphu 
2020-09-11 01:10:02, Good Morning Bhutan Four more positive cases yesterday May they get well soon https t co QZnJmG3B7A , ChhedupSangay , Bhutan ,1148,Thimphu 
2020-09-11 00:55:13, Thank you xf0 x9f x99 x8f ALL at Super Zone Four Changbangdu Though it was short stay but we had great memories to look back Serve Your Best For The Community You guys are exemplary Long Live Our Supreme Commander xf0 x9f x99 x8f xf0 x9f x99 x8f xf0 x9f x99 x8f https t co BMYIv1kqVM , bhutan majestic , ,1148,Thimphu 
2020-09-10 21:41:10, COVID19UPDATE Phuntsholing 4 new cases detected at flu clinic 2 officials working at Mini Dry Port and 2 RBA personnel who are contacts of the cases detected earlier All were under quarantine , kuenzakarma , COVID19UPDATE Phuntsholing ,1393,Thimphu 
2020-09-10 16:53:08, premierleague Players will wear a No Room For Racism sleeve badge throughout 2020 21 season https t co 0AsuNvLahu , ChhedupSangay , ,1148,Thimphu 
2020-09-10 16:40:45, anilduhoon rahulkanwal Where you are breaking your head Sir Leave them they are beyond repair They only worry about TRP , vikrantparate , ,22,Thimphu 
2020-09-10 16:37:21, Shawn Warstein GcwaOnline Shawn Warstein Druk need tag term partner too you be ready to fight next to Druk , BhutanBeast , ,33,Thimphu 
2020-09-10 16:18:56, HuXijin GT It may otherwise China might have incurred greatest war as well as logistics losses Be aware of Indian Army Learn a lessons from Kargil War , vikrantparate , ,22,Thimphu 
2020-09-10 16:18:36, HuXijin GT Pakistan sponsored and China supposed terrorism imposed on India has one good outcome too Indian Army is always in combating mode which gives us strength , vikrantparate , ,22,Thimphu 
2020-09-10 16:10:29, Thank you for the great talk on genetic testing in FSGS and SRNS in children Dr KeishaGibson xf0 x9f x91 x8d UNCKidney , jimjatz , ,33,Thimphu 
2020-09-10 15:56:55, Looking forward to this seminar https t co Fgb6chSEKc , davidmhecht , ,508,Thimphu 
2020-09-10 15:10:55, Always learning something from her https t co tXfcud7IkB , namgayzam , ,24161,Thimphu 
2020-09-10 14:59:55, Bbhutan3 Austerity measures such as switching lights and doing cashless and digital should have been embraced much earlier In the long term it will save a lot in terms of efficiency but there will be negligible short term savings , sandeeps13 , ,280,Thimphu 
2020-09-10 14:58:40, Bbhutan3 Agree that loan waivers help the ones with large loan portfolios but a lot of the loans are held by small businesses and farmers and cooperatives Waiving loans meant preventing default Also puts money indirectly in the pockets for spending , sandeeps13 , ,280,Thimphu 
2020-09-10 14:53:08, Bbhutan3 Stopping imports of vehicles won xe2 x80 x99t solve the economic crisis we are currently in but will result in a favorable forex reserve The whole situation is made all the worse due to a high number of NPL PRIOR to the pandemic , sandeeps13 , ,280,Thimphu 
2020-09-10 14:49:26, San Francisco with background music of Blade Runner 2049 Welcome to the post apocalypse world https t co zzUlRATmqx , sandeeps13 , ,280,Thimphu 
2020-09-10 14:11:03, For want of a clear economic plan https t co NR1msibNGB , Shachagyeltshen , ,121,Thimphu 
2020-09-10 13:55:42, Two Foreign Ministers of India and China meets today Hoping for some good outcome May peace prevail , ChhedupSangay , ,1148,Thimphu 
2020-09-10 12:22:05, norten ugyen Thanks you la , NamgaySkidas , ,347,Paro 
2020-09-10 10:08:27, Prime Time on Indian News Stations https t co t2xA10R5rT , TenzingLamsang , ,24456,Thimphu 
2020-09-10 10:06:52, Along with Covid 19 DeSuung Pin we are fortunate to receive Sungki amp Thrichu for our Nyamroos Long Live Our Supreme Commander xf0 x9f x99 x8f xf0 x9f x99 x8f xf0 x9f x99 x8f Thimphu Bhutan https t co BEmd8lV2wB , bhutan majestic , ,1148,Thimphu 
2020-09-10 09:58:42, Fall In for DeSuup Covid 19 Pin Ceremony from Super Zone 4 Changbangdu Kuenselphodrang Thimphu https t co r7kaiqjOVT , bhutan majestic , ,1148,Thimphu 
2020-09-10 09:57:04, My King is My Hero DeSuup Covid 19 Pin Thimphu Bhutan https t co KYJEyArRyM , bhutan majestic , ,1148,Thimphu 
2020-09-10 09:55:48, With Super Zone 1 Babesa Outgoing Super Zone Gojay Ata Wangchuck amp Sub Gojays after the Handing amp Taking Ceremony The Tsenden Boutique https t co lLxa8EetLm , bhutan majestic , ,1148,Thimphu 
2020-09-10 09:54:24, Handing amp Taking of Super Zone 1 Babesa from Ata Wangchuck Thank you Ata Sub Gojays and Fellow Nyamroos for all your Service to Babesa Super Zone Community and I commit to continue and do my best The Tsenden Boutique https t co qMA5Vg72yk , bhutan majestic , ,1148,Thimphu 
2020-09-10 09:47:09, thebhutanese Confusing , PhuntshoWangs , ,33,Thimphu 
2020-09-10 09:22:12, PM narendramodi reviews development work at Kedarnath Dham stresses on need to have pilgrim environment friendly facilities https t co Ixx63NcfNO PMOIndia MEAIndia PIB India IndianDiplomacy PBNS India DDNewslive PMBhutan FMBhutan , Indiainbhutan , ,11370,Thimphu 
2020-09-10 09:12:29, When you have absolutely no arsenal in store for her Dove I may not have the Earth or the wealth but I can assure you I have no family history of diabetes mellitus or hypertension , Tobgay333 , ,50,Thimphu 
2020-09-10 09:05:11, The Ministry of Agriculture and Forests shares the pricelist for onion and tomato to prevent exorbitant rates charged by wholesaler and retailers https t co YchFB485J0 https t co V2PvuYKVE1 , moafbhutan , pricelist ,485,Thimphu 
2020-09-10 07:19:04, Little too excited even though you are 21 days away and imagine how excited I would be when only 1 day is left xf0 x9f xa4 xaa xf0 x9f xa4 xaa happyfeeling lovelife homecoming , ha na 08 , happyfeeling lovelife homecoming ,866,Thimphu 
2020-09-10 07:10:43, Maldives and Sri Lanka receives citation from WHO for having eliminated the Rubella WHO 73RCmeeting , ugyentse , WHO 73RCmeeting ,88,Thimphu 
2020-09-10 07:03:31, In view of the high demand from the general public the MoAF is facilitating the import of onions and tomatoes through Food Corporation of Bhutan Limited https t co czmMgImwGK , moafbhutan , ,485,Thimphu 
2020-09-10 07:02:31, Because you are such a practical realist you may find the inf More for Virgo https t co ytH6jMhay1 , czdorji , ,2313,Thimphu 
